brief_name,eng_name,name
-1,-1,CÔNG TY TNHH ĐẦU TƯ THƯƠNG MẠI NHẬT LINH
-1,-1,CÔNG TY TNHH THIÊN PHÚ BÌNH AN
-1,HA NOI ARCHITECTURE URBAN FURNITURE JOINT STOCK COMPANY,Công Ty Cổ Phần Kiến Trúc Nội Thất Đô Thị Hà Nội
TNS DECOR JSC,TNS DECOR JSC,CÔNG TY CỔ PHẦN DỊCH VỤ THIẾT KẾ VÀ THI CÔNG TNS DECOR
-1,-1,CÔNG TY TNHH XÂY DỰNG PHÁT TRIỂN TRƯỜNG THÀNH
SAIGON HERITAGE,Saigon Heritage Corporation,Công Ty Cổ Phần Saigon Heritage
-1,-1,CÔNG TY TRÁCH NHIỆM HỮU HẠN XÂY DỰNG HANBAEK
CÔNG TY TNHH SƠN MẠNH BẮC GIANG,CÔNG TY TNHH SƠN MẠNH BẮC GIANG,CÔNG TY TNHH SƠN MẠNH BẮC GIANG
HUANG KIM XUAN TRADING AND PRODUCE COMPANY LIMITED,HUANG KIM XUAN TRADING AND PRODUCE COMPANY LIMITED,CÔNG TY TNHH THƯƠNG MẠI VÀ SẢN XUẤT HUANG KIM XUÂN
-1,"A.A.C.E CO., LTD",CÔNG TY TNHH TƯ VẤN THƯƠNG MẠI DỊCH VỤ A.A.C.E
-1,THUAN PHAT TRAVEL SERVICES TRADING CONSTRUCTION COMPANY LIMI,CÔNG TY TNHH XÂY DỰNG THƯƠNG MẠI DỊCH VỤ DU LỊCH THUẬN PHÁT
"THIEN NGUYEN ADVERTISING MEDIA CO.,LTD","THIEN NGUYEN ADVERTISING MEDIA CO.,LTD",CÔNG TY TNHH TRUYỀN THÔNG QUẢNG CÁO THIÊN NGUYÊN
CONG TY TNHH XNK HOÀI YẾN,Công Ty TNHH Xuất Nhập Khẩu Hoài Yến,Công Ty TNHH Xuất Nhập Khẩu Hoài Yến
HONG MINH PRODUCTION TRADING DEVELOPMENT COMPANY LIMITED,HONG MINH PRODUCTION TRADING DEVELOPMENT COMPANY LIMITED,CÔNG TY TNHH PHÁT TRIỂN THƯƠNG MẠI SẢN XUẤT HỒNG MINH
CÔNG TY TNHH SX - TM - DV GỖ PALLET TÂN TÂM PHÁT,CONG TY TNHH SX - TM - DV GO PALLET TAN TAM PHAT,CÔNG TY TNHH SẢN XUẤT - THƯƠNG MẠI - DỊCH VỤ GỖ PALLET TÂN TÂM PHÁT
CTY TNHH MTV XD VÀ TTNNT GIA BẢO ĐỒNG THÁP,CTY TNHH MTV XD VÀ TTNNT GIA BẢO ĐỒNG THÁP,CÔNG TY TNHH MỘT THÀNH VIÊN XÂY DỰNG VÀ TRANG TRÍ NỘI NGOẠI THẤT GIA BẢO ĐỒNG THÁP
-1,-1,CÔNG TY TNHH ĐỨC LỘC
-1,-1,CÔNG TY TNHH VIET IDEAS PLUS
KY LOITECH CORP,KY LOITECH CORP,CÔNG TY CỔ PHẦN CÔNG NGHỆ KỲ LỢI
-1,-1,CÔNG TY CỔ PHẦN XÂY DỰNG THƯƠNG MẠI VÀ VẬN TẢI PHÚ THUẬN
THUY LINH PLYWOOD PRODUCTION AND EXPORT COMPANY LIMITED,THUY LINH PLYWOOD PRODUCTION AND EXPORT COMPANY LIMITED,CÔNG TY TNHH SẢN XUẤT VÀ XUẤT KHẨU GỖ DÁN THUỶ LINH
-1,"LIEN THANH FOOD TRADING CO.,LTD",CÔNG TY TNHH THƯƠNG MẠI THỰC PHẨM LIÊN THANH
-1,-1,CÔNG TY TNHH THƯƠNG MẠI DỊCH VỤ DU LỊCH VISA THIÊN HÀ
"NAPA RESORT CO., LTD",NAPA RESORT COMPANY LIMITED,CÔNG TY TNHH NAPA RESORT
DONG A TECHNICAL AND TRADING JOINT STOCK COMPANY,DONG A TECHNICAL AND TRADING JOINT STOCK COMPANY,CÔNG TY CỔ PHẦN THƯƠNG MẠI VÀ KỸ THUẬT ĐÔNG A
-1,-1,CÔNG TY CỔ PHẦN ĐẦU TƯ VÀ THƯƠNG MẠI BÌNH TIẾN
-1,-1,CÔNG TY TNHH MỘT THÀNH VIÊN THƯƠNG MẠI VÀ XÂY DỰNG TOÀN PHÁT
-1,CÔNG TY ALPHA,CÔNG TY TNHH CÔNG NGHỆ THÔNG TIN ALPHA
SSI INVESTCO JSC,Ssi Construction Investment Joint Stock Company,Công Ty Cổ Phần Đầu Tư Xây Dựng Ssi
-1,-1,CÔNG TY CỔ PHẦN NIHON BUSSAN
"DAIAE CO., LTD","DAIAE CO., LTD",CÔNG TY TNHH MỘT THÀNH VIÊN THANG MÁY KỸ THUẬT ĐIỆN ĐẠI Á
-1,-1,CÔNG TY TNHH MỘT THÀNH VIÊN HẢI HÀ QUÁN
-1,-1,CÔNG TY TNHH ĐÁ CÚC KHANG
-1,-1,CÔNG TY TNHH MTV XÂY DỰNG HIỆP TRƯỜNG PHÁT
-1,-1,CÔNG TY TNHH MỘT THÀNH VIÊN THƯƠNG MẠI DỊCH VỤ KIM MINH 369
-1,-1,CÔNG TY TNHH ĐỒ CHƠI TUẤN HUY TÂN
SPAN BRIDGE CORPORATION,SPAN BRIDGE CORPORATION,CÔNG TY CỔ PHẦN NHỊP CẦU
-1,-1,CÔNG TY TNHH SẢN XUẤT VÀ THƯƠNG MẠI PCN VIỆT NAM
"310 DESIGN CO.,LTD",310 Design Company Limited,Công Ty TNHH 310 Design
-1,-1,CÔNG TY TNHH SUNGJIN VĨNH LONG VINA (NỘP THUẾ THAY NTNN)
VIET- THAI AEC COMPANY LIMITED,VIET- THAI AEC COMPANY LIMITED,CÔNG TY TNHH VIỆT - THÁI AEC
-1,-1,CÔNG TY TNHH THƯƠNG MẠI DỊCH VỤ ANH KHÔI PHÁT
"ANH QUI CO.,LTD",ANH QUI TRADING CONSTRUCTION COMPANY LIMITED,CÔNG TY TNHH XÂY DỰNG THƯƠNG MẠI ANH QUÍ
-1,-1,CÔNG TY TNHH MINH THUỶ
-1,-1,CÔNG TY TRÁCH NHIỆM HỮU HẠN THIẾT BỊ AN TOÀN VÀ ĐIỆN NƯỚC VẠN LỘC
-1,-1,CÔNG TY TNHH MTV ĐỨC HUY- PHƯỚC VINH
POWER ENGINEERING CONSULTING INDOCHINA JOINT STOCK COMPANY,POWER ENGINEERING CONSULTING INDOCHINA JOINT STOCK COMPANY,CÔNG TY CỔ PHẦN TƯ VẤN XÂY DỰNG ĐIỆN ĐÔNG DƯƠNG
-1,-1,CÔNG TY CP ĐẦU TƯ VÀ TƯ VẤN XÂY DỰNG DT
-1,"SONG LONG THIEN CO.,LTD",CÔNG TY TNHH SONG LONG THIÊN
-1,-1,CÔNG TY TNHH SẢN XUẤT VÀ DỊCH VỤ THƯƠNG MẠI NAM HẢI
-1,"THANH LONG TRADING IMPORT EXPORT CO.,LTD",CÔNG TY TNHH THƯƠNG MẠI XUẤT NHẬP KHẨU THÀNH LONG
"VINH HUNG IC.,JSC","VINH HUNG IC.,JSC",CÔNG TY CP VĨNH HOÀ HƯNG
THÀNH ĐÔ,THÀNH ĐÔ,CÔNG TY TNHH THÀNH ĐÔ
NTN,NTN,CÔNG TY TNHH SẢN XUẤT - THƯƠNG MẠI - DỊCH VỤ NGỌC THÀNH NAM
-1,-1,CÔNG TY TNHH XÂY DỰNG VÀ THƯƠNG MẠI PHÚC SƠN 4
"XINGZHAO VIETNAM CO., LTD","XINGZHAO VIETNAM CO., LTD",CÔNG TY TNHH XINGZHAO VIỆT NAM
"KHAI HOAN NHAN CO.,LTD","KHAI HOAN NHAN CO.,LTD",CÔNG TY TNHH MỘT THÀNH VIÊN THƯƠNG MẠI - DỊCH VỤ KHẢI HOÀN NHÂN
THINH KHOI TRADING AND TECHNICAL COMPANY LIMITED,THINH KHOI TRADING AND TECHNICAL COMPANY LIMITED,CÔNG TY TNHH THƯƠNG MẠI VÀ KỸ THUẬT THỊNH KHÔI
"NDCSC CO.,LTD","NDCSC CO.,LTD",CÔNG TY TNHH TƯ VẤN- DỊCH VỤ NGUYỄN DƯƠNG
TRUNG HIEU ADVERTISING AND INTERIOR COMPANY LIMITED,TRUNG HIEU ADVERTISING AND INTERIOR COMPANY LIMITED,CÔNG TY TRÁCH NHIỆM HỮU HẠN QUẢNG CÁO VÀ NỘI THẤT TRUNG HIẾU
"DAI SAC MAU CO.,LTD","DAI SAC MAU CO.,LTD",CÔNG TY TNHH ĐẠI SẮC MÀU
ZERO DIRTY TECHNICAL COMPANY LIMITED,ZERO DIRTY TECHNICAL COMPANY LIMITED,CÔNG TY TNHH KỸ THUẬT KHÔNG ĐỘ
"BEAUTY MASTER CO.,LTD","BEAUTY MASTER CO.,LTD",CÔNG TY TNHH MỘT THÀNH VIÊN BEAUTY MASTER
"TEECC.,JSC","TEECC.,JSC","CÔNG TY CỔ PHẦN CÔNG NGHỆ SINH THÁI, MÔI TRƯỜNG VÀ BIẾN ĐỔI KHÍ HẬU"
TPT TOURISM AND HOTEL SERVICE COMPANY LIMITED,TPT TOURISM AND HOTEL SERVICE COMPANY LIMITED,CÔNG TY TNHH MTV DỊCH VỤ DU LỊCH VÀ KHÁCH SẠN TPT
LIMITED LIABILITY COMPANY KHANH DUY HOANG,LIMITED LIABILITY COMPANY KHANH DUY HOANG,CÔNG TY TNHH HOÀNG DUY KHÁNH
"VINACHIP TECH .,JSC","VINACHIP TECH .,JSC",CÔNG TY CỔ PHẦN PHÁT TRIỂN CÔNG NGHỆ VINACHIP
CÔNG TY TNHH THỰC PHẨM XANH BẮC KẠN,Công Ty TNHH Thực Phẩm Xanh Bắc Kạn,Công Ty TNHH Thực Phẩm Xanh Bắc Kạn
-1,-1,CÔNG TY CỔ PHẦN DỊCH VỤ VÀ TÍCH HỢP CÔNG NGHỆ
-1,-1,CÔNG TY TNHH AN THẠCH LÂM
"KIM DAI NAM CO., LTD",Kim Dai Nam Trading Service Company Limited,Công Ty TNHH Thương Mại Dịch Vụ Kim Đại Nam
"BAO AN HUY SERVIC CO ., LTD","BAO AN HUY SERVIC CO ., LTD",CÔNG TY TNHH THƯƠNG MẠI VÀ DỊCH VỤ BẢO AN HUY
-1,-1,CÔNG TY TNHH NAM TÚ
"HEMERA., JSC","HEMERA., JSC",CÔNG TY CỔ PHẦN THỜI TRANG VÀ MỸ PHẨM HEMERA
-1,"CATHICO., LTD",CÔNG TY TNHH CẦN THỊNH
-1,-1,CÔNG TY TNHH KIẾN TRÚC NHÀ THÉP THIẾT MỘC
CÔNG TY TNHH KHANG ĐẠT,CÔNG TY TNHH KHANG ĐẠT,CÔNG TY TRÁCH NHIỆM HỮU HẠN KHANG ĐẠT
-1,"AN.MI CO., LTD",CÔNG TY TNHH AN.MI
-1,-1,CÔNG TY TNHH MTV THƯƠNG MẠI ĐỨC ĐẠT
-1,-1,CÔNG TY TNHH GIÁO DỤC ĐÀO TẠO KHAI SÁNG TRẺ
-1,-1,CÔNG TY TNHH MỘT THÀNH VIÊN SẢN XUẤT VÀ THƯƠNG MẠI HOÀNG ANH TUẤN
GLOBAL COMMON TRADING PRODUCTION COMPANY LIMITED,Global Common Trading Production Company Limited,Công Ty TNHH Sản Xuất Thương Mại Thông Dụng Toàn Cầu
BVND JSC,BVND JSC,CÔNG TY CỔ PHẦN THƯƠNG MẠI BVND
"INMOBI INTELLIGENT MOBILE SOLUTIONS CO.,LTD","INMOBI INTELLIGENT MOBILE SOLUTIONS CO.,LTD",CÔNG TY TNHH GIẢI PHÁP DI DỘNG THÔNG MINH INMOBI
-1,-1,CÔNG TY TNHH STARPRINT VIỆT NAM
VIET NAM FRANCE JOINT - VENTURE LIMITED COMPANY,VIET NAM FRANCE JOINT - VENTURE LIMITED COMPANY,CÔNG TY TNHH LIÊN DOANH VIỆT PHÁP
-1,-1,CÔNG TY TNHH THƯƠNG MẠI DỊCH VỤ GỖ VƯƠNG THỊNH
-1,Red Tiger Trading Services Company Limited,Công Ty TNHH Thương Mại Dịch Vụ Cọp Đỏ
CÔNG TY CỔ PHẦN TRUNG HƯNG,CÔNG TY CỔ PHẦN TRUNG HƯNG,CÔNG TY CỔ PHẦN TRUNG HƯNG
-1,-1,CÔNG TY TNHH THƯƠNG MẠI DỊCH VỤ DU LỊCH TUẤN PHƯỢNG
-1,-1,CÔNG TY TNHH THƯƠNG MẠI VÀ PHÁT TRIỂN HOÀNG THÁI
-1,E-WINDOW CONSTRUCTION,CÔNG TY CỔ PHẦN THƯƠNG MẠI DỊCH VỤ VÀ XÂY DỰNG E-WINDOW
-1,-1,CÔNG TY SAEHAN HITECH
-1,-1,CÔNG TY TNHH HÙNG ANH
CTY TNHH MTV VÕ KIM PHƯỢNG,CTY TNHH MTV VO KIM PHUONG,CÔNG TY TNHH MỘT THÀNH VIÊN VÕ KIM PHƯỢNG
LE NGA CONSTRUCTION COMPANY LIMITED,LE NGA CONSTRUCTION COMPANY LIMITED,CÔNG TY TNHH XÂY DỰNG LÊ NGA
"LINH HOA PHAT.,JSC","LINH HOA PHAT.,JSC",CÔNG TY CỔ PHẦN THƯƠNG MẠI ĐIỆN TỬ VÀ XUẤT NHẬP KHẨU LINH HÒA PHÁT
OAK PLUS JSC,OAK PLUS JSC,CÔNG TY CỔ PHẦN OAK PLUS
"SUPER DRY (VIETNAM) CO.,LTD","SUPER DRY (VIETNAM) CO.,LTD",CÔNG TY TNHH SUPER DRY (VIỆT NAM)
"T L CO.,LTD","T L CO.,LTD",CÔNG TY TNHH MỘT THÀNH VIÊN THÚY LOAN
-1,-1,CÔNG TY TNHH VẬT TƯ CÔNG NGHIỆP KIÊN TRUNG
TIKCO,Tikco Company Limited,Công Ty TNHH Tikco
NIXING COMPANY LIMITED,NIXING COMPANY LIMITED,CÔNG TY TNHH NIXING
-1,"VINA ART CO., LTD",CÔNG TY TNHH THƯƠNG MẠI XÂY DỰNG XUẤT NHẬP KHẨU VINA ART
"EHA CO.,LTD","EHA CO.,LTD",CÔNG TY TNHH EHA
"AN PHÚ VINH SUPPLIES.,LTD","AN PHÚ VINH SUPPLIES.,LTD",CÔNG TY TNHH THƯƠNG MẠI VẬT TƯ AN PHÚ VINH
"3A MEPATI., JSC","3A MEPATI., JSC",CÔNG TY CỔ PHẦN ĐẦU TƯ THƯƠNG MẠI VÀ SẢN XUẤT THIẾT BỊ Y TẾ 3A
"TDI CO .,LTD","TDI CO .,LTD",CÔNG TY TNHH PHÁT TRIỂN CÔNG NGHỆ VÀ XÂY DỰNG VIỆT NAM
CTY TNHH LONG VU,CTY TNHH LONG VU,CÔNG TY TNHH LONG VŨ
K AND H CONSULTANT COM,K AND H INVESTMENT CONSULTANT TRADE SERVICE COMPANY LIMITED,CÔNG TY TNHH TƯ VẤN ĐẦU TƯ THƯƠNG MẠI DỊCH VỤ K VÀ H
WORLD PAPER VIETNAM COMPANY LIMITED,WORLD PAPER VIETNAM COMPANY LIMITED,CÔNG TY TNHH THẾ GIỚI GIẤY VIỆT NAM
-1,-1,CÔNG TY TNHH MỘT THÀNH VIÊN THƯƠNG MẠI DỊCH VỤ KIẾN HẢI
-1,"HOANG LAN DEVELOPMENT IMPORT EXPORT SERVICE TRADING CO.,LTD",CÔNG TY TNHH THƯƠNG MẠI DỊCH VỤ XUẤT NHẬP KHẨU PHÁT TRIỂN HOÀNG LAN
PMCM,PMCM,CÔNG TY CỔ PHẦN VẬT LIỆU PMC
"LU HANH DAK LAK CO.,LTD","LU HANH DAK LAK CO.,LTD",CÔNG TY TNHH THƯƠNG MẠI DỊCH VỤ LỮ HÀNH ĐẮK LẮK
"BI NGOC NGUYEN CO., LTD",BI NGOC NGUYEN COMPANY LIMITED,CÔNG TY TNHH BI NGỌC NGUYÊN
-1,-1,CÔNG TY TNHH SẢN XUẤT THƯƠNG MẠI SẮC VIỆT
TAM AI COMPANY LIMITED,TAM AI COMPANY LIMITED,CÔNG TY TNHH TÂM AI
-1,THAI DUONG TRADING AND PRODUCTION DEVELOPMENT COMPANY LIMITED,CÔNG TY TNHH PHÁT TRIỂN SẢN XUẤT VÀ THƯƠNG MẠI THÁI DƯƠNG
-1,TAN AU VIET TRADE - SERVICE - CONSTRUCTION COMPANY LIMITED,CÔNG TY TNHH THƯƠNG MẠI - DỊCH VỤ - XÂY DỰNG TÂN ÂU VIỆT
-1,-1,CÔNG TY CỔ PHẦN THƯƠNG MẠI AN PHƯỚC
"NHAT BAO PHU THO CO., LTD","NHAT BAO PHU THO CO., LTD",CÔNG TY TNHH NHẬT BẢO PHÚ THỌ
GREEN ECOTECH COMPANY LIMITED,GREEN ECOTECH COMPANY LIMITED,CÔNG TY TNHH ECOTECH XANH
-1,-1,CÔNG TY TNHH ĐẦU TƯ VÀ PHÁT TRIỂN HƯNG THỊNH PHÁT NINH BÌNH
-1,-1,CÔNG TY TNHH REGINA MIRACLE INTERNATIONAL VIỆT NAM
CÔNG TY TNHH XÂY DỰNG BÙI GIA PHÁT ĐIỆN BIÊN,CÔNG TY TNHH XÂY DỰNG BÙI GIA PHÁT ĐIỆN BIÊN,CÔNG TY TNHH XÂY DỰNG BÙI GIA PHÁT ĐIỆN BIÊN
-1,-1,CÔNG TY CỔ PHẦN DỰ ÁN CÔNG NGHỆ EXIMCO
"DUY PHAT AGRICULTURAL CO.,LTD","DUY PHAT AGRICULTURAL CO.,LTD",CÔNG TY TNHH NÔNG SẢN DUY PHÁT
-1,-1,CÔNG TY TNHH THƯƠNG MẠI VÀ ĐẦU TƯ XÂY DỰNG KỲ ANH
"DANH TRUONG CO.,LTD","DANH TRUONG CO.,LTD",CÔNG TY TNHH MỘT THÀNH VIÊN THƯƠNG MẠI & DỊCH VỤ DANH TRƯỜNG
"EURO FOODS VIETNAM CO.,LTD","EURO FOODS VIETNAM CO.,LTD",CÔNG TY TNHH EURO FOODS VIETNAM
S&P NETWORKS JSC,S&P NETWORKS JSC,CÔNG TY CỔ PHẦN S&P NETWORKS
"HUY TIEN EDUCATION CO., LTD","HUY TIEN EDUCATION CO., LTD",CÔNG TY TNHH GIÁO DỤC VÀ ĐÀO TẠO HUY TIẾN
-1,-1,CÔNG TY TNHH THƯƠNG MẠI DỊCH VỤ VẬN TẢI BÌNH AN PHÁT
THUAN HOA JOINT STOCK COMPANY,THUAN HOA JOINT STOCK COMPANY,CÔNG TY CỔ PHẦN THUẬN HOÀ
"THE RESERVE MEKONG CO.,LTD","THE RESERVE MEKONG CO.,LTD",CÔNG TY TNHH THE RESERVE MEKONG
"PHAT THIEN AN CO.,LTD",PHAT THIEN AN ELECTRIC COMPANY LIMITED,CÔNG TY TNHH ĐIỆN PHÁT THIÊN AN
"LUONG GIA XD & TM CO., LTD","LUONG GIA XD & TM CO., LTD",CÔNG TY TNHH XÂY DỰNG VÀ THƯƠNG MẠI LƯƠNG GIA
-1,Công Ty TNHH 1tv Bảo Cát Tường,Công Ty TNHH 1tv Bảo Cát Tường
-1,-1,CÔNG TY CỔ PHẦN ĐẦU TƯ XÂY DỰNG KIỆN HÀ
-1,-1,CÔNG TY TNHH NĂNG LƯỢNG TÁI TẠO 2 BÌNH THUẬN (NTNN)
"VNIEE.,JSC","VNIEE.,JSC",CÔNG TY CỔ PHẦN THIẾT BỊ GIÁO DỤC VÀ NỘI THẤT VIỆT NAM
-1,-1,CÔNG TY TNHH GIAO NHẬN P.T.C
-1,-1,CÔNG TY TNHH MỘT THÀNH VIÊN VÂN KHÁNH PHÁT
-1,-1,CÔNG TY TNHH TM & DV THỦY SẢN HOÀNG DƯƠNG
CÔNG TY ĐẠI QUANG,CÔNG TY ĐẠI QUANG,CÔNG TY TNHH TMDV ĐẠI QUANG
-1,-1,CÔNG TY TNHH THƯƠNG MẠI BẢO UYÊN
-1,Tran Tai Nhan Company Limited,Công Ty TNHH Trần Tài Nhân
"LY PHUONG TRADING CO., LTD","LY PHUONG TRADING CO., LTD",CÔNG TY TNHH ĐẦU TƯ THƯƠNG MẠI LÝ PHƯƠNG
-1,-1,CÔNG TY TNHH XÂY DỰNG AN PHÁT VŨNG TÀU
FUJIMART TRADING AND GENERAL SERVICES COMPANY LIMITED,FUJIMART TRADING AND GENERAL SERVICES COMPANY LIMITED,CÔNG TY TRÁCH NHIỆM HỮU HẠN THƯƠNG MẠI VÀ DỊCH VỤ TỔNG HỢP FUJIMART
-1,"DANANGTRECO., LTD",CÔNG TY TNHH XÂY DỰNG - THƯƠNG MẠI - DỊCH VỤ ĐA NĂNG TRẺ
"APTRA., JSC","APTRA., JSC",CÔNG TY CỔ PHẦN THƯƠNG MẠI AN PHÚ THÀNH
-1,-1,CÔNG TY TNHH MỘT THÀNH VIÊN HÀ AN - VITOURS
CÔNG TY TNHH V527,CÔNG TY TNHH V527,CÔNG TY TNHH V527
CCI,CCI,CÔNG TY CỔ PHẦN ĐẦU TƯ CON CƯNG
-1,-1,CÔNG TY TNHH XDTH PHÚ LỘC
CÔNG TY TNHH XD DV ĐÌNH VŨ),CÔNG TY TNHH XD DV ĐÌNH VŨ),CÔNG TY TNHH XÂY DỰNG DỊCH VỤ ĐÌNH VŨ
-1,-1,CÔNG TY TNHH MTV PHÁT TRIỂN PHÚ NGUYỄN
"PENTATECH CO.,LTD",Pentatech Electrical Engineering Company Limited,Công Ty TNHH Mtv Kỹ Thuật Điện Pentatech
-1,-1,CÔNG TY TNHH HẢI SƠN NINH BÌNH
HANAN,HANAN,CÔNG TY TNHH HANAN
EEI JOINT STOCK COMPANY,EEI JOINT STOCK COMPANY,CÔNG TY CỔ PHẦN EEI
CÔNG TY TNHH TỔNG HỢP ĐIỆN LẠNH QUANG VINH,Công Ty TNHH Tổng Hợp Điện Lạnh Quang Vinh,Công Ty TNHH Tổng Hợp Điện Lạnh Quang Vinh
HALL OF GOODS LLC,HALL OF GOODS LIMITED LIABILITY COMPANY,Công Ty TNHH Hall Of Goods
-1,GREEN SUN TRADING PRODUCTION COMPANY LIMITED,CÔNG TY TNHH SẢN XUẤT THƯƠNG MẠI MẶT TRỜI XANH
-1,-1,CÔNG TY TRÁCH NHIỆM HỮU HẠN MỘT THÀNH VIÊN MỸ BÍCH TRÂM
-1,-1,CÔNG TY CỔ PHẦN BIGVIO VIỆT NAM
-1,SAI GON STAR CONSTRUCTION COMPANY LIMITED,CÔNG TY TNHH XÂY DỰNG SÀI GÒN STAR
"LIVIN CO.,LTD","LIVIN CO.,LTD",CÔNG TY TNHH MTV THƯƠNG MẠI VÀ DU LỊCH LIVIN
LINH DUNG INVESTMENT AND DEVELOPMENT COMPANY LIMITED,LINH DUNG INVESTMENT AND DEVELOPMENT COMPANY LIMITED,CÔNG TY TNHH ĐẦU TƯ VÀ PHÁT TRIỂN LINH DŨNG
-1,-1,CÔNG TY TNHH VŨ NGUYÊN
KHANG KHOA TRAVEL SERVICE DEVELOPMENT INVESTMENT COMPANY LIMITED,KHANG KHOA TRAVEL SERVICE DEVELOPMENT INVESTMENT COMPANY LIMITED,CÔNG TY TNHH ĐẦU TƯ PHÁT TRIỂN DỊCH VỤ DU LỊCH KHANG KHOA
-1,-1,CÔNG TY CỔ PHẦN ĐẦU TƯ TẤN ĐẠI PHÁT
-1,-1,CÔNG TY TNHH THƯƠNG MẠI VÀ DỊCH VỤ ĐẠI LỘC
-1,-1,CÔNG TY TNHH MỘT THÀNH VIÊN THƯƠNG MẠI VẬN TẢI MINH HOÀNG
-1,-1,CÔNG TY TNHH MỘT THÀNH VIÊN TRUNG ANH TUẤN
"T&T VINAPRO .,JSC","T&T VINAPRO .,JSC",CÔNG TY CỔ PHẦN ĐẦU TƯ & PHÁT TRIỂN VINAPRO
"PHONG MINH HIEN CO., LTD","PHONG MINH HIEN CO., LTD",CÔNG TY TNHH PHONG MINH HIỀN
NGHIA BINH SERVICE AND TRADING COMPANY LIMITED,NGHIA BINH SERVICE AND TRADING COMPANY LIMITED,CÔNG TY TNHH THƯƠNG MẠI VÀ DỊCH VỤ NGHĨA BÌNH
-1,-1,CÔNG TY TNHH MỘT THÀNH VIÊN THƯƠNG MẠI DIỄM QUỲNH
"GIA MINH TRADING AND TRANSPORT CO.,LTD",GIA MINH TRADING AND TRANSPORT COMPANY LIMITED,CÔNG TY TNHH THƯƠNG MẠI VÀ VẬN CHUYỂN GIA MINH
"AN NINH CO., LTD","AN NINH CO., LTD",CÔNG TY TNHH AN NINH
"AAHC CO., LTD",Asia Human Capital Solution And Consulting Services Company Limited,Công Ty TNHH Dịch Vụ Tư Vấn Và Giải Pháp Nguồn Nhân Lực Châu Á
-1,-1,CÔNG TY TNHH PHÂN PHỐI HƯƠNG HÀ
-1,-1,CÔNG TY TNHH KINH DOANH DỊCH VỤ BẢO VỆ HT 369
-1,"PHI HUNG PHAT CONSTRUCTION SERVICE TRADING CO., LTD",CÔNG TY TNHH THƯƠNG MẠI DỊCH VỤ XÂY DỰNG PHI HƯNG PHÁT
-1,PHAN DUNG JSC,CÔNG TY CỔ PHẦN XÂY DỰNG VẬN TẢI THƯƠNG MẠI PHAN DŨNG
-1,-1,CÔNG TY CỔ PHẦN ĐẦU TƯ DỊCH VỤ VÀ THƯƠNG MẠI BẮC BÌNH - VĂN PHÒNG ĐẠI DIỆN MIỀN TRUNG
-1,-1,CÔNG TY TNHH THƯƠNG MẠI TẤT LỘC
"SONGROUP.,.JSC","SONGROUP.,.JSC",CÔNG TY CỔ PHẦN SON GROUP
-1,-1,CÔNG TY TNHH SẢN XUẤT VÀ THƯƠNG MẠI MỸ PHẨM NHÂN NGHĨA
-1,-1,CÔNG TY TNHH XUẤT NHẬP KHẨU - DỊCH VỤ - THƯƠNG MẠI - VẬN TẢI VINA XANH
"MUOI PHUONG CO., LTD","MUOI PHUONG CO., LTD",CÔNG TY TNHH MƯỜI PHƯƠNG
CTY TNHH CỔNG NHÔM ĐÚC HOÀNG VI,Hoang Vi Cast Aluminum Gate Company Limited,Công Ty TNHH Cổng Nhôm Đúc Hoàng Vi
-1,-1,CÔNG TY CỔ PHẦN CÔNG NGHỆ PHẦN MỀM VIỆT MỸ
CTGDMX,CTGDMX,CÔNG TY TNHH GIÁO DỤC MẦM XANH
"D & T MEKONG CO.,LTD","D & T MEKONG CO.,LTD",CÔNG TY TNHH TM DV DU LỊCH D & T CỬU LONG
VIET NAM MEDIA AND SOFTWARE COMPANY LIMITED,VIET NAM MEDIA AND SOFTWARE COMPANY LIMITED,CÔNG TY CỔ PHẦN PHẦN MỀM VÀ TRUYỀN THÔNG VIỆT NAM
"NGUYEN MINH CHAU CO.,LTD","NGUYEN MINH CHAU CO.,LTD",CÔNG TY TNHH DỊCH VỤ NGUYỄN MINH CHÂU
"TRUONG QUAN CONTRA CO.,LTD","TRUONG QUAN CONTRA CO.,LTD",CÔNG TY TNHH ĐẦU TƯ XÂY DỰNG VÀ THƯƠNG MẠI TRƯỜNG QUÂN
-1,CCR CORP,CÔNG TY CỔ PHẦN DỊCH VỤ BẤT ĐỘNG SẢN TRUNG TÂM THÀNH PHỐ
"AN NAM CTI .,JSC","AN NAM CTI .,JSC",CÔNG TY CỔ PHẦN ĐẦU TƯ THƯƠNG MẠI XÂY DỰNG AN NAM
CÔNG TY TNHH XD PHƯỚC HÙNG TG,CÔNG TY TNHH XD PHƯỚC HÙNG TG,CÔNG TY TRÁCH NHIỆM HỮU HẠN XD PHƯỚC HÙNG TG
CÔNG TY TNHH TM - DV CHĂM SÓC SỨC KHỎE SAU SINH,CÔNG TY TNHH TM - DV CHĂM SÓC SỨC KHỎE SAU SINH,CÔNG TY TNHH THƯƠNG MẠI DỊCH VỤ CHĂM SÓC SỨC KHỎE SAU SINH
CÔNG TY TNHH SẢN XUẤT VÀ THƯƠNG MẠI CÁT ĐẰNG,CÔNG TY TNHH SẢN XUẤT VÀ THƯƠNG MẠI CÁT ĐẰNG,CÔNG TY TNHH SẢN XUẤT VÀ THƯƠNG MẠI CÁT ĐẰNG
-1,-1,CÔNG TY TNHH CÔNG NGHỆ TỰ ĐỘNG
-1,VINATECH,CÔNG TY CỔ PHẦN ĐẦU TƯ VÀ PHÁT TRIỂN CÔNG NGHỆ VIỆT NAM
-1,"THUAN THIEN TRADING CONSTRUCT INVESTMENT SERVICE CO.,LTD",CÔNG TY TNHH DỊCH VỤ ĐẦU TƯ XÂY DỰNG THƯƠNG MẠI THUẬN THIÊN
"CBOT VIET NAM.,JSC",VIET NAM CBOT JOINT STOCK COMPANY,CÔNG TY CỔ PHẦN CBOT VIỆT NAM
-1,-1,CÔNG TY CỔ PHẦN PHÁT TRIỂN CÔNG NGHỆ & THƯƠNG MẠI BA ĐÌNH
-1,-1,CÔNG TY CỔ PHẦN XUẤT NHẬP KHẨU VÀ CHẾ BIẾN LÂM SẢN VIỆT HƯNG
-1,Công Ty TNHH Xây Dựng Đầu Tư Và Tư Vấn Thiết Kế Phước Lợi,Công Ty TNHH Xây Dựng Đầu Tư Và Tư Vấn Thiết Kế Phước Lợi
-1,-1,CÔNG TY CP THỦY ĐIỆN NGÀN TRƯƠI
-1,"PHUOC HUNG LOC CO.,LTD",CÔNG TY TNHH THƯƠNG MẠI DỊCH VỤ PHƯỚC HƯNG LỘC
"HOANG ANH COMPUTER SERVICES TRADE CO., LTD","HOANG ANH COMPUTER SERVICES TRADE CO., LTD",CÔNG TY TNHH THƯƠNG MẠI DỊCH VỤ VI TÍNH HOÀNG ANH
-1,-1,Công Ty TNHH Bình Minh 55
"BÁ NHUẬN CO.,LTD","BÁ NHUẬN CO.,LTD",CÔNG TY TNHH BÁ NHUẬN
CÔNG TY TNHH SUNNY TRAVEL,SUNNY TRAVEL SERVICE AND TRADING COMPANY LIMITED,CÔNG TY TNHH THƯƠNG MẠI VÀ DỊCH VỤ SUNNY TRAVEL
-1,-1,CÔNG TY TNHH CÔNG NGHỆ TÂN TIẾN PHÁT
-1,-1,CÔNG TY TNHH SẢN XUẤT-THƯƠNG MẠI KHÁCH SẠN KIM LIÊN
-1,-1,Công Ty TNHH Dv Tm Nghiệp Thành Khôi Lâm
-1,-1,CÔNG TY TNHH TRƯỜNG PHÁT PHƯỚC VINH
"CEMENT CONNECTIVE .,JSC","CEMENT CONNECTIVE .,JSC",CÔNG TY CỔ PHẦN LIÊN KẾT PHÁT TRIỂN XI MĂNG
CÔNG TY MTV HÀN TIÊN VINA,CÔNG TY MTV HÀN TIÊN VINA,CÔNG TY TNHH MỘT THÀNH VIÊN HÀN TIÊN VINA
-1,HOANG TIEN INVESTMENT - CONSTRUCTION AND DEVELOPMENT COMPANY,CÔNG TY TNHH ĐẦU TƯ - XÂY DỰNG VÀ PHÁT TRIỂN HOÀNG TIẾN
-1,Công Ty TNHH Nam Trung Hưng,Công Ty TNHH Nam Trung Hưng
TAN A VINA VIET NAM JOINT STOCK COMPANY,TAN A VINA VIET NAM JOINT STOCK COMPANY,CÔNG TY CỔ PHẦN VINA TÂN Á VIỆT NAM
-1,-1,CÔNG TY TNHH MỘT THÀNH VIÊN LÊ KHÁNH
-1,-1,CÔNG TY TNHH HUỆ TÀI
-1,EME CO.LTD,CÔNG TY TNHH THIẾT BỊ CƠ KHÍ ĐIỆN TỬ
"GIA THANH AD CO.,LTD","GIA THANH AD CO.,LTD",CÔNG TY TNHH MỘT THÀNH VIÊN DỊCH VỤ  THƯƠNG MẠI QUẢNG CÁO GIA THÀNH
"DAI CAT COMMERCIAL BUSINESS PRODUCTION CO.,LTD","DAI CAT COMMERCIAL BUSINESS PRODUCTION CO.,LTD",CÔNG TY TNHH SẢN XUẤT KINH DOANH THƯƠNG MẠI ĐẠI CÁT
TTHY,TTHY,CÔNG TY TNHH THƯƠNG MẠI VÀ DỊCH VỤ TÍN THỊNH HƯNG YÊN
"EUROPE TRADING CO., LTD","EUROPE TRADING CO., LTD",CÔNG TY TNHH THƯƠNG MẠI ÂU CHÂU
-1,-1,CÔNG TY TNHH THƯƠNG MẠI AN TRỌNG
"VIETSEA EDUCATION CO.,LTD",VIETSEA EDUCATION AND TECHNOLOGY COMPANY LIMITED,CÔNG TY TNHH GIÁO DỤC VÀ CÔNG NGHỆ VIETSEA
-1,-1,CÔNG TY TNHH THÚ Y THỦY SẢN PIQ
-1,-1,CÔNG TY TNHH THƯƠNG MẠI VÀ VẬN TẢI DD-QN 568
"SONG KIM VIET NAM.,JSC","SONG KIM VIET NAM.,JSC",CÔNG TY CỔ PHẦN SONG KIM VIỆT NAM
AN PHAT THINH TRADE JOINT STOCK COMPANY,AN PHAT THINH TRADE JOINT STOCK COMPANY,CÔNG TY CỔ PHẦN THƯƠNG MẠI AN PHÁT THỊNH
"LAMT ., JSC",LINH ANH VINA MANUFACTURING AND TRADING JOINT STOCK COMPANY,CÔNG TY CỔ PHẦN SẢN XUẤT VÀ THƯƠNG MẠI LINH ANH VINA
-1,NAM HUNG BUILDING MATERIAL COMPANY LIMITED,CÔNG TY TNHH MỘT THÀNH VIÊN VẬT LIỆU XÂY DỰNG NAM HƯNG
-1,-1,CÔNG TY TNHH XÂY DỰNG VIẾT QUYÊN
CÔNG TY TNHH PHẠM HOÀNG AN,CÔNG TY TNHH PHẠM HOÀNG AN,CÔNG TY TNHH PHẠM HOÀNG AN
-1,-1,CÔNG TY TNHH HÀO ĐỨC
-1,-1,CÔNG TY CỔ PHẦN XUẤT NHẬP KHẨU TÂN TÂN PHÚ
"SANPOYOSHI CO.,LTD",SANPOYOSHI COMPANY LIMITED,CÔNG TY TNHH SANPOYOSHI
TIEN HA STELL TRADING AND PRODUCTION COMPANY LIMITED,TIEN HA STELL TRADING AND PRODUCTION COMPANY LIMITED,CÔNG TY TNHH SẢN XUẤT VÀ THƯƠNG MẠI THÉP TIẾN HÀ
-1,"THINH DIEN CONSTRUCTION TECHNOLOGY CO.,LTD",CÔNG TY TNHH CÔNG NGHỆ XÂY DỰNG THỊNH ĐIỀN
CT TNHH TM XNK HH,CT TNHH TM XNK HH,CÔNG TY TNHH XUẤT NHẬP KHẨU TM HỒNG HÀ
-1,SAO NAM BAC COMPANY LIMITED,CÔNG TY TNHH SAO NAM BẮC
-1,-1,CÔNG TY CỔ PHẦN XUẤT NHẬP KHẨU THƯƠNG MẠI A&B VIỆT NAM
"CHAU THUAN PHAT S&T CO.,LTD",CHAU THUAN PHAT SERVICE AND TRADING COMPANY LIMITED,CÔNG TY TNHH DỊCH VỤ VÀ THƯƠNG MẠI CHÂU THUẬN PHÁT
-1,-1,CÔNG TY TNHH MTV ĐẦU TƯ VÀ XÂY DỰNG NGHĨA HƯNG THỊNH
-1,-1,CÔNG TY TNHH QUANG MINH NB
BIG TEAM INTERNATIONAL GOURMET LIMITED COMPANY,BIG TEAM INTERNATIONAL GOURMET LIMITED COMPANY,CÔNG TY TNHH BIG TEAM INTERNATIONAL GOURMET
CÔNG TY THƯƠNG MẠI TRƯỜNG LỘC PHÁT ĐẮK LẮK,CÔNG TY THƯƠNG MẠI TRƯỜNG LỘC PHÁT ĐẮK LẮK,CÔNG TY TNHH THƯƠNG MẠI TRƯỜNG LỘC PHÁT ĐẮK LẮK
-1,-1,CÔNG TY TNHH MTV ĐẦU TƯ PHÁT TRIỂN PHƯƠNG ANH
-1,-1,CÔNG TY TNHH MỘT THÀNH VIÊN TOÀN THƯ
"DAI PHAT CONS.,JSC","DAI PHAT CONS.,JSC",CÔNG TY CỔ PHẦN THƯƠNG MẠI QUỐC TẾ VÀ XÂY DỰNG ĐẠI PHÁT
REVEL MEDIA,REVEL MEDIA,CÔNG TY CỔ PHẦN REVEL MEDIA
THANH SON GREEN ENVIRONMENT JOINT STOCK COMPANY,THANH SON GREEN ENVIRONMENT JOINT STOCK COMPANY,CÔNG TY CỔ PHẦN MÔI TRƯỜNG XANH THANH SƠN
"CƯU LONG CO., LTD","CƯU LONG CO., LTD",CÔNG TY TNHH CỬU LONG
-1,-1,CÔNG TY TNHH THƯƠNG MẠI SẢN XUẤT NỆM VIỆT Á
-1,Công Ty TNHH Giải Pháp Phần Mềm Và Dịch Vụ Trực Tuyến Sng,Công Ty TNHH Giải Pháp Phần Mềm Và Dịch Vụ Trực Tuyến Sng
HAIVAN FASHION AND TRADE COMPANY LIMITED,HAIVAN FASHION AND TRADE COMPANY LIMITED,CÔNG TY TNHH THƯƠNG MẠI VÀ THỜI TRANG HẢI VÂN
-1,-1,CÔNG TY TNHH MTV XD – TM – DV PHÁT TIẾN
GOSOLAR NEW ENERGY DEVELOPMENT JOINT STOCK COMPANY,GOSOLAR NEW ENERGY DEVELOPMENT JOINT STOCK COMPANY,CÔNG TY CỔ PHẦN PHÁT TRIỂN NĂNG LƯỢNG MỚI GOSOLAR
-1,-1,CÔNG TY TNHH DỊCH VỤ QUÁN ĂN VƯỜN XOÀI
-1,"S.M.N ENTERTAINMENT CO.,LTD",CÔNG TY TNHH GIẢI TRÍ BẢY NỐT NHẠC
"CHQ VIETNAM., JSC","CHQ VIETNAM., JSC",CÔNG TY CỔ PHẦN TƯ VẤN ĐẦU TƯ XÂY DỰNG VÀ THƯƠNG MẠI CHQ VIỆT NAM
-1,-1,CÔNG TY TNHH YU CHENG TAI VN
NOVA MEDICA,NOVA MEDICA,CÔNG TY CỔ PHẦN NOVA MEDICA
2X2 ARCHITECTS JSC,2X2 ARCHITECTS JSC,CÔNG TY CỔ PHẦN KIÊN TRUC 2X2
"HONG CHAU CO.,LTD)","HONG CHAU CO.,LTD)",CÔNG TY TNHH VẬT LIỆU XÂY DỰNG HỒNG CHÂU
CÔNG TY TẬP ĐOÀN BẤT ĐỘNG SẢN PHÚ LONG THỊNH,CÔNG TY TẬP ĐOÀN BẤT ĐỘNG SẢN PHÚ LONG THỊNH,CÔNG TY TRÁCH NHIỆM HỮU HẠN TẬP ĐOÀN DU LỊCH VÀ KINH DOANH BẤT ĐỘNG SẢN PHÚ LONG THỊNH
-1,LOC VIET JSC,CÔNG TY CỔ PHẦN SẢN XUẤT VÀ THƯƠNG MẠI LỘC VIỆT
A&H CONSULTING SERVICE TRADING COMPANY LIMITED,A&H CONSULTING SERVICE TRADING COMPANY LIMITED,CÔNG TY TNHH THƯƠNG MẠI DỊCH VỤ TƯ VẤN A&AMP;H
"TRUONG XUAN STP CO.,LTD",Truong Xuan Sticking Plaster Company Limited,Công Ty TNHH Băng Keo Trường Xuân
-1,-1,CÔNG TY TNHH NAM VIỆT
"BAMBOO TRAVEL., CORP","BAMBOO TRAVEL., CORP",CÔNG TY CỔ PHẦN LỮ HÀNH TRE VIỆT
-1,-1,CÔNG TY TNHH SẢN XUẤT THƯƠNG MẠI ANH LINH
-1,-1,CÔNG TY TNHH DỊCH VỤ-TƯ VẤN MINH BÁU
-1,-1,CÔNG TY TNHH METAL ONE (VIỆT NAM)
