brief_name,eng_name,name
-1,S&t Logistics And Trading Service Company Limited,Công Ty TNHH Tiếp Vận Và Dịch Vụ Thương Mại S&t
-1,-1,CÔNG TY TRÁCH NHIỆM HỮU HẠN THƯƠNG MẠI VẬN TẢI MAY PHÚC AN
-1,-1,CÔNG TY TNHH BÁCH THI
CTY TNHH MTV DƯƠNG ĐÔNG - GIA LAI,CTY TNHH MTV DƯƠNG ĐÔNG - GIA LAI,CÔNG TY TNHH MỘT THÀNH VIÊN DƯƠNG ĐÔNG - GIA LAI
-1,-1,CÔNG TY TNHH THƯƠNG MẠI DỊCH VỤ VẬT LIỆU XÂY DỰNG YẾN NGỌC
-1,-1,CÔNG TY TNHH MỘT THÀNH VIÊN KỸ NGHỆ
"KIEN TRUC ADH, JSC","KIEN TRUC ADH, JSC",CÔNG TY CỔ PHẦN KIẾN TRÚC ADH
-1,-1,"CÔNG TY CỔ PHẦN ĐẦU TƯ, THƯƠNG MẠI HOÀNG CÔNG"
"MTV ADS., JSC","MTV ADS., JSC",CÔNG TY CỔ PHẦN QUẢNG CÁO VÀ DỊCH VỤ MẶT TRỜI VIỆT
-1,-1,CÔNG TY TNHH MỘT THÀNH VIÊN NHÀ MI
CTY TNHH TT&DV VIETSHOW CÀ MAU,CTY TNHH TT&DV VIETSHOW CÀ MAU,CÔNG TY TNHH TRUYỀN THÔNG VÀ DỊCH VỤ VIETSHOW CÀ MAU
-1,-1,CÔNG TY TNHH VIỆT TẤN
G.D.S COMPANY LIMITED,G.D.S COMPANY LIMITED,CÔNG TY TRÁCH NHIỆM HỮU HẠN G.D.S
"B5 IT CO., LTD","B5 IT CO., LTD",CÔNG TY TNHH THƯƠNG MẠI VÀ CÔNG NGHỆ THÔNG TIN B5
"CHIEN THUY PHU THO CO.,LTD","CHIEN THUY PHU THO CO.,LTD",CÔNG TY TNHH CHIẾN THỦY PHÚ THỌ
-1,-1,CÔNG TY TNHH THƯƠNG MẠI DỊCH VỤ TƯỜNG UYÊN
-1,-1,CÔNG TY TRÁCH NHIỆM HỮU HẠN TUẤN HÀ
"VESTA PHARMA.,JSC",VESTA PHARMACEUTICAL DEVELOP JOINT STOCK COMPANY,CÔNG TY CỔ PHẦN PHÁT TRIỂN DƯỢC VESTA
-1,-1,CÔNG TY TNHH VIỆT THÔNG XANH
-1,-1,CÔNG TY TNHH MỸ LINH PLASTIC
"THIEN LONG FISHERY IMPORT PRODUCTION CO., LTD",Thien Long Fishery Import Production Company Limited,Công Ty TNHH Sản Xuất - Nhập Khẩu Thủy Sản Thiên Long
CÔNG TY TNHH MTV CÚN YÊU,Công Ty TNHH Mtv Cún Yêu,Công Ty TNHH Mtv Cún Yêu
-1,-1,CÔNG TY TNHH MTV KHẮC DẤU & QUẢNG CÁO BẰNG LĂNG
168 CONTRUCTION HAULAGE TRADING ONE MEMBER COMPANY LIMITED,168 CONTRUCTION HAULAGE TRADING ONE MEMBER COMPANY LIMITED,CÔNG TY TNHH MỘT THÀNH VIÊN THƯƠNG MẠI VẬN TẢI XÂY DỰNG 168
TRONG TIEN ELECTRASSECO,TRONG TIEN ELECTRASSECO,CÔNG TY CỔ PHẦN XÂY LẮP ĐIỆN LÂM HOA
DUC HIEP TRACO-JSC,DUC HIEP TRACO-JSC,CÔNG TY CỔ PHẦN THƯƠNG MẠI VẬN TẢI VÀ XÂY DỰNG ĐỨC HIỆP
NGOC LAC GREENFOODS,Ngoc Lac Greenfoods Joint Stock Company,Công Ty Cổ Phần Greenfoods Ngọc Lặc
SOUND WORLD SVS COMPANY LIMITED,SOUND WORLD SVS COMPANY LIMITED,CÔNG TY TNHH SVS THẾ GIỚI ÂM THANH
CÔNG TY TNHH MỘT THÀNH VIÊN DỊCH VỤ VIỄN THÔNG BẢO TOÀN,CÔNG TY TNHH MỘT THÀNH VIÊN DỊCH VỤ VIỄN THÔNG BẢO TOÀN,CÔNG TY TNHH MỘT THÀNH VIÊN DỊCH VỤ VIỄN THÔNG BẢO TOÀN
THANH HAI DUNG COMPANY LIMITED,THANH HAI DUNG COMPANY LIMITED,CÔNG TY TNHH THÀNH HẢI DUNG
-1,CTY TNHH TV TK ĐỊA ỐC,CÔNG TY TNHH TƯ VẤN THIẾT KẾ ĐỊA ỐC
THIÊN PHÚ 667,THIÊN PHÚ 667,CÔNG TY CỔ PHẦN XÂY DỰNG THIÊN PHÚ 667
-1,-1,CÔNG TY TNHH HẢI KẾ
-1,-1,CÔNG TY TNHH SẢN XUẤT VÀ THƯƠNG MẠI THỊNH PHÁT
CIC,CIC,CÔNG TY CỔ PHẦN TƯ VẤN & XÂY DỰNG CIC
DANTRACE.JSC,DANTRACE.JSC,CÔNG TY CP THƯƠNG MẠI DỊCH VỤ ĐỨC NHÂN SEN VÀNG
-1,-1,CÔNG TY CỔ PHẦN TƯ VẤN XÂY DỰNG VÀ THƯƠNG MẠI BÌNH MINH HƯNG YÊN
-1,"K.E.N.T S T P CO.,LTD",CÔNG TY TNHH SẢN XUẤT THƯƠNG MẠI DỊCH VỤ K.E.N.T
SOFA ĐẠI PHÁT,DAI PHAT SOFA COMPANY LIMITED,CÔNG TY TNHH SOFA ĐẠI PHÁT
"GIA HƯNG HR SOLUTION CO.,LTD","GIA HƯNG HR SOLUTION CO.,LTD",CÔNG TY TNHH GIẢI PHÁP NHÂN LỰC GIA HƯNG
-1,THANH DAT WASTE WATER TREATMENT OPERATION MANAGEMENT COMPANY LIMITED,CÔNG TY TNHH QUẢN LÝ VẬN HÀNH XỬ LÝ NƯỚC THẢI THÀNH ĐẠT
-1,"THANH TIN IMP.& EXP.TRADE CO.,LTD",CÔNG TY TNHH THƯƠNG MẠI VÀ XUẤT NHẬP KHẨU THÀNH TÍN
-1,-1,CÔNG TY TNHH SẢN XUẤT THƯƠNG MẠI MỸ PHẨM LUCASTA
-1,-1,CÔNG TY TNHH MỘT THÀNH VIÊN NHẬT HỒNG PHÁP
CTCP ĐIỆN TỬ - VIỄN THÔNG SAO VIỆT,CTCP ĐIỆN TỬ - VIỄN THÔNG SAO VIỆT,CÔNG TY CỔ PHẦN ĐIỆN TỬ - VIỄN THÔNG SAO VIỆT
-1,-1,CÔNG TY TNHH TM & DV YOUR HOME
"HUONG DUONG .,JSC","HUONG DUONG .,JSC",CÔNG TY CỔ PHẦN SẢN XUẤT VÀ THƯƠNG MẠI HƯỚNG DƯƠNG
-1,"HKTECH CO., LTD",CÔNG TY TNHH KỸ THUẬT CÔNG NGHỆ HỢP KHANG
CTY CP NĂNG LƯỢNG SẠCH BẮC SƠN,CTY CP NăNG LượNG SạCH BắC SơN,CÔNG TY CỔ PHẦN NĂNG LƯỢNG SẠCH BẮC SƠN
-1,-1,CÔNG TY TNHH SẢN XUẤT THƯƠNG MẠI BAO BÌ PHẠM NGUYỄN
CTY TNHH MTV KHANG AN KHÊ,CTY TNHH MTV KHANG AN KHE,CÔNG TY TNHH MỘT THÀNH VIÊN KHANG AN KHÊ
THUAN PHAT INDUSTRY SERVICE AND TRADING CONSTRUCTION JOINT S,THUAN PHAT INDUSTRY SERVICE AND TRADING CONSTRUCTION JOINT S,CÔNG TY CỔ PHẦN XÂY DỰNG THƯƠNG MẠI VÀ DỊCH VỤ CÔNG NGHIỆP THUẬN PHÁT
"DU BI CO.,LTD","DU BI CO.,LTD",CÔNG TY TNHH XÂY DỰNG THƯƠNG MẠI DŨNG CÔNG BÌNH
"DONG HWA CO., LTD","DONG HWA CO., LTD",CÔNG TY TNHH DONG HWA
-1,-1,CÔNG TY CỔ PHẦN ĐẦU TƯ VÀ PHÁT TRIỂN LŨNG LÔ 5 - VĂN PHÒNG ĐẠI DIỆN TẠI THÀNH PHỐ HỒ CHÍ MINH
-1,-1,CÔNG TY TNHH XUÂN CƯƠNG
-1,-1,CÔNG TY TNHH THƯƠNG MẠI HỮU HÙNG
TOP INTERNATIONAL TRAVEL COMPANY LIMITED,TOP INTERNATIONAL TRAVEL COMPANY LIMITED,CÔNG TY TNHH LỮ HÀNH QUỐC TẾ ĐỈNH CAO
"GREEN APPAREL VINA CO.,LTD","GREEN APPAREL VINA CO.,LTD",CÔNG TY TNHH GREEN APPAREL VIỆT NAM
-1,-1,CÔNG TY TNHH LÂM SẢN MINH KHANG
"HANSHIN CO.,LTD","HANSHIN CO.,LTD",CÔNG TY TNHH HANSHIN
-1,-1,Công Ty Cổ Phần Xây Lắp Cơ Điện Phúc An
-1,-1,CÔNG TY CỔ PHẦN ĐẦU TƯ PHÁT TRIỂN HUY HOÀNG PHÚ QUỐC
-1,-1,CÔNG TY TNHH TƯ VẤN XÂY DỰNG B.K
"CLSS CO.,LTD",Central Labour Safety Services Supplying Limited Company,Công Ty TNHH Cung Ứng Dịch Vụ An Toàn Lao Động Miền Trung
"NOBLE KING CO.,LTD",NOBLE KING COMPANY LIMITED,CÔNG TY TNHH NOBLE KING
-1,-1,CÔNG TY TNHH THƯƠNG MẠI DỊCH VỤ NGỌC SAN SAN
CÔNG TY TNHH THƯƠNG MẠI VÀ DỊCH VỤ MINH THÀNH CÔNG,CÔNG TY TNHH THƯƠNG MẠI VÀ DỊCH VỤ MINH THÀNH CÔNG,CÔNG TY TNHH THƯƠNG MẠI VÀ DỊCH VỤ MINH THÀNH CÔNG
-1,-1,CÔNG TY TNHH DỊCH VỤ TƯ VẤN VÀ ĐẦU TƯ SAO VIỆT
-1,-1,CÔNG TY TNHH XÂY DỰNG- THƯƠNG MẠI PHƯƠNG ANH ANH
-1,BAN MAI PRODUCTION ELECTRICAL EQUIPMENT COMPANY LIMITED,CÔNG TY TNHH SẢN XUẤT THIẾT BỊ ĐIỆN BAN MAI
-1,-1,CÔNG TY TNHH VẬT TƯ VÀ XÂY DỰNG HOÀNG THÀNH
-1,"PHAN VINH CO., LTD",CÔNG TY TNHH CƠ KHÍ CHÍNH XÁC PHAN VINH
"VIET HUNG CONTRASER CO.,LTD","VIET HUNG CONTRASER CO.,LTD",CÔNG TY TNHH XÂY DỰNG THƯƠNG MẠI VÀ DỊCH VỤ VIỆT HƯNG
LAM SOFTWARE,LAM SOFTWARE,CÔNG TY TNHH PHẦN MỀM LÊ ANH MINH
-1,-1,CÔNG TY CỔ PHẦN XÂY DỰNG TÂN TRƯỜNG PHÁT
CONSTRUCTION INVESTMENT - DEVELOPMENT INFRASTRUCTURE URBAN AND INDUSTRIAL ZONE JOINT STOCK COMPANY,CONSTRUCTION INVESTMENT - DEVELOPMENT INFRASTRUCTURE URBAN AND INDUSTRIAL ZONE JOINT STOCK COMPANY,CÔNG TY CỔ PHẦN ĐẦU TƯ XÂY DỰNG - PHÁT TRIỂN HẠ TẦNG ĐÔ THỊ VÀ KHU CÔNG NGHIỆP
-1,-1,CÔNG TY TNHH THƯƠNG MẠI VÀ DỊCH VỤ NGUYỄN ĐỨC
HOA CUONG GARMENT ONE MEMBER COMPANY LIMITED,HOA CUONG GARMENT ONE MEMBER COMPANY LIMITED,CÔNG TY TNHH MTV MAY MẶC HÒA CƯƠNG
-1,-1,CÔNG TY TNHH TÂN TOÀN THẮNG
-1,-1,CÔNG TY TNHH THƯƠNG MẠI VÀ DỊCH VỤ XÂY DỰNG NHẬT MINH
-1,-1,CÔNG TY TNHH MTV CƠ KHÍ VÀ XÂY DỰNG THÀNH AN
THAI DUONG IMEXCONCO,THAI DUONG IMPORT EXPORT CONSTRUCTION JOINT STOCK COMPANY,CÔNG TY CỔ PHẦN XUẤT NHẬP KHẨU XÂY DỰNG THÁI DƯƠNG
PDA CORPORATION,PDA CORPORATION,CÔNG TY CỔ PHẦN PDA
CTY TNHH MTV QTB,CÔNG TY TNHH MỘT THÀNH VIÊN QTB,CÔNG TY TNHH MỘT THÀNH VIÊN QTB
-1,LITHAPHACO,CÔNG TY CỔ PHẦN SẢN XUẤT THƯƠNG MẠI DỊCH VỤ LIÊN THÀNH PHÁT
-1,-1,CÔNG TY TNHH THƯƠNG MẠI & XÂY DỰNG PHƯƠNG LINH
VMISS ENTERTAINMENT COMPANY LIMITED,VMISS ENTERTAINMENT COMPANY LIMITED,CÔNG TY TNHH VMISS ENTERTAINMENT
-1,USC TRADING- TRAVEL COMPANY LIMITED,CÔNG TY TNHH THƯƠNG MẠI - DU LỊCH USC
RUBIK,RUBIK,CÔNG TY CỔ PHẦN ĐẦU TƯ RUBIK
-1,-1,CÔNG TY TNHH MỘT THÀNH VIÊN DỊCH VỤ THƯƠNG MẠI HÀ LỘC VƯƠNG
"ECTECH .,JSC",ECTECH VIET NAM TRADING AND SERVICE JOINT STOCK COMPANY,CÔNG TY CỔ PHẦN THƯƠNG MẠI VÀ DỊCH VỤ ECTECH VIỆT NAM
"VANIMEXCO., LTD",VAN ANH IMPORT EXPORT INVESTMENT COMPANY LIMITED -HO CHI MINH CITY BRANCH,CÔNG TY TNHH ĐẦU TƯ XUẤT NHẬP KHẨU VÂN ANH-CHI NHÁNH THÀNH PHỐ HỒ CHÍ MINH
-1,-1,CÔNG TY TRÁCH NHIỆM HỮU HẠN MỘT THÀNH VIÊN THƯƠNG MẠI DỊCH VỤ BẮC PHONG
ICCOR JOINT STOCK COMPANY - NAM DINH BRANCH,ICCOR JOINT STOCK COMPANY - NAM DINH BRANCH,CÔNG TY CỔ PHẦN ICCOR - CHI NHÁNH NAM ĐỊNH
PAPAYA JOINT STOCK COMPANY,Papaya Joint Stock Company,Công Ty Cổ Phần Papaya
"R3VN CO., LTD","R3VN CO., LTD",CÔNG TY TNHH R3 VIỆT NAM
"VIET NAM - LIEN BANG NGA ., JSC",VIET NAM - LIEN BANG NGA IMPORT EXPORT JOINT STOCK COMPANY,CÔNG TY CỔ PHẦN XUẤT NHẬP KHẨU VIỆT NAM - LIÊN BANG NGA
-1,-1,CÔNG TY TNHH NHẬP KHẨU CÔNG NGHỆ CAO
"AQUA CITY HOA BINH CO., LTD",Aqua City Hoa Binh Company Limited,Công Ty TNHH Aqua City Hòa Bình
"STARSHINE MARKETING CO.,LTD","STARSHINE MARKETING CO.,LTD",CÔNG TY TNHH THƯƠNG MẠI MỸ PHẨM HOÀNG KIM
XINH DOCOR,XINH DOCOR,CÔNG TY TNHH THƯƠNG MẠI DỊCH VỤ NỘI THẤT XINH
CÔNG TY TP LÊ NGUYỄN,CÔNG TY TP LÊ NGUYỄN,CÔNG TY TNHH SẢN XUẤT THƯƠNG MẠI DỊCH VỤ THỰC PHẨM LÊ NGUYỄN
MANH HIEU TRADING INVESTMENT COMPANY LIMITED,MANH HIEU TRADING INVESTMENT COMPANY LIMITED,CÔNG TY TNHH ĐẦU TƯ THƯƠNG MẠI MẠNH HIẾU
-1,-1,CÔNG TY TRÁCH NHIỆM HỮU HẠN GIẢI PHÁP TRẦN NGUYỄN
-1,-1,CÔNG TY TNHH THƯƠNG MẠI DỊCH VỤ CÔNG NGHỆ LÝ GIA - CHI NHÁNH CAI LẬY
TUAN LAM IMPORT EXPORT AND TRADING COMPANY LIMITED,Tuan Lam Import Export And Trading Company Limited,Công Ty TNHH Thương Mại Và Xuất Nhập Khẩu Tuấn Lâm
-1,-1,Công Ty TNHH Tv & Đtxd Nam Dũng
"KHANH LE CO., LTD",KHANH LE KOREAN LANGUAGE COMPANY LIMITED,CÔNG TY TNHH HÀN NGỮ KHÁNH LÊ
CTY TNHH MTV NGUYỄN CHÍ TÂM,CTY TNHH MTV NGUYỄN CHÍ TÂM,CÔNG TY TRÁCH NHIỆM HỮU HẠN MỘT THÀNH VIÊN NGUYỄN CHÍ TÂM
-1,-1,CÔNG TY CỔ PHẦN ĐẦU TƯ THƯƠNG MẠI VÀ XUẤT NHẬP KHẨU ÔTÔ THĂNG LONG
-1,HHD TRADING SERVICE EXPORT IMPORT COMPANY LIMITED,CÔNG TY TNHH THƯƠNG MẠI DỊCH VỤ XUẤT NHẬP KHẨU HHD
"ITS CO., LTD","ITS CO., LTD",CÔNG TY TNHH DỊCH VỤ VÀ GIẢI PHÁP TIN HỌC VIỆT HÙNG
CTY TNHH MTV SX TM DV THÔN VỸ,CTY TNHH MTV SX TM DV THÔN VỸ,CÔNG TY TNHH MỘT THÀNH VIÊN SẢN XUẤT THƯƠNG MẠI DỊCH VỤ THÔN VỸ
-1,-1,CÔNG TY TNHH THIẾT BỊ Y TẾ Y CAO
XDA HA NOI CIVIL AND CONSTRUCTION INDUSTRY COMPANY LIMITED,Xda Ha Noi Civil And Construction Industry Company Limited,Công Ty TNHH Xây Dựng Công Nghiệp Và Dân Dụng Xda Hà Nội
-1,"THU PHU TRADE SERVICE CO.,LTD",CÔNG TY TNHH THƯƠNG MẠI DỊCH VỤ THU PHÚC
-1,"THANH TAM CO.,LTD",CÔNG TY TNHH MỘT THÀNH VIÊN THƯƠNG MẠI SẢN XUẤT DỊCH VỤ THÀNH TÂM
VINALINES NHA TRANG,VINALINES NHA TRANG,CÔNG TY CỔ PHẦN VINALINES NHA TRANG
-1,-1,CÔNG TY TNHH TM DV THIẾT BỊ PCCC PHÚC THÀNH
"ANH TU THANH DAT CO.,LTD","ANH TU THANH DAT CO.,LTD",CÔNG TY TNHH THƯƠNG MẠI - XUẤT NHẬP KHẨU ANH TÚ THÀNH ĐẠT
-1,AN PHAT COSMETICS CHEMICAL COMPANY LIMITED,CÔNG TY TNHH HÓA MỸ PHẨM AN PHÁT
-1,-1,CÔNG TY TNHH DONGRIWON DEVELOPMENT VIỆT NAM
-1,-1,CÔNG TY TNHH MTV ĐẠI PHÁT STEEL
HUYNH KHUONG DAT SERVICE TRADING JOINT STOCK COMPANY,HUYNH KHUONG DAT SERVICE TRADING JOINT STOCK COMPANY,CÔNG TY CỔ PHẦN THƯƠNG MẠI DỊCH VỤ HUỲNH KHƯƠNG ĐẠT
-1,-1,CÔNG TY CP XNK VÀ VẬN TẢI PHƯỚC LÀNH
-1,TAN DAI JOINT STOCK COMPANY,CÔNG TY CỔ PHẦN ĐẦU TƯ VÀ PHÁT TRIỂN TÂN ĐẠI
-1,STE VIET INVESTMENT AND ENVIRONMENT CONSULTANCY JOINT STOCK COMPANY,Công Ty Cổ Phần Tư Vấn Đầu Tư Và Môi Trường Ste Việt
"LINK HOME REAL ESTATE CO.,LTD",LINK HOME REAL ESTATE COMPANY LIMITED,CÔNG TY TNHH BẤT ĐỘNG SẢN LINK HOME
"NO 68 CCIT ., JSC","NO 68 CCIT ., JSC",CÔNG TY CỔ PHẦN XÂY DỰNG THUỶ LỢI VÀ THƯƠNG MẠI 68
"VINH PHUC DT-CC.,JSC","VINH PHUC DT-CC.,JSC",CÔNG TY CỔ PHẦN TƯ VẤN XÂY DỰNG VÀ PHÁT TRIỂN CÔNG NGHỆ VĨNH PHÚC
BACH VIET TECHNOLOGY AND MEASUREMENT COMPANY LIMITED,BACH VIET TECHNOLOGY AND MEASUREMENT COMPANY LIMITED,CÔNG TY TNHH ĐO LƯỜNG VÀ CÔNG NGHỆ BÁCH VIỆT
-1,-1,CÔNG TY TNHH ĐẦU TƯ PHÁT TRIỂN VẬN TẢI HÙNG DŨNG
-1,-1,CÔNG TY CỔ PHẦN TƯ VẤN GIÁO DỤC VÀ VĂN HOÁ - TRUYỀN THÔNG HÀ THÀNH
TRUNG KIEN PT COMPANY LIMITED,TRUNG KIEN PT COMPANY LIMITED,CÔNG TY TNHH TRUNG KIÊN PT
LAPIS INVESTMENT JOINT STOCK COMPANY,LAPIS INVESTMENT JOINT STOCK COMPANY,CÔNG TY CỔ PHẦN ĐẦU TƯ LAPIS
-1,-1,CÔNG TY TNHH SẢN XUẤT VÀ THƯƠNG MẠI ANH HÒA
CÔNG TY CỔ PHẦN DU LỊCH LÂM VIÊN,CÔNG TY CỔ PHẦN DU LỊCH LÂM VIÊN,CÔNG TY CỔ PHẦN DU LỊCH LÂM VIÊN
"TLS.,JSC","TLS.,JSC",CÔNG TY CỔ PHẦN ĐẦU TƯ PHÁT TRIỂN THƯƠNG MẠI VÀ BẤT ĐỘNG SẢN THĂNG LONG SP.ZOO
-1,-1,CÔNG TY TNHH ĐẦU TƯ DỊCH VỤ THƯƠNG MẠI TRỊNH NGUYỄN
-1,-1,CÔNG TY TNHH ĐẦU TƯ VÀ PHÁT TRIỂN ĐẠI HẢI THỊNH
"A CHAU FUTRA CO., LTD","A CHAU FUTRA CO., LTD",CÔNG TY TNHH THƯƠNG MẠI NỘI THẤT Á CHÂU
-1,"TOUR THAI DUONG SERVICE TRADING CO., LTD",Công Ty TNHH Thương Mại Dịch Vụ Tour Thái Dương
"TIPHON .,JSC","TIPHON .,JSC",CÔNG TY CỔ PHẦN TIẾN PHONG VIỆT NAM
PHU MY THANH,PHU MY THANH,CÔNG TY CỔ PHẦN CHẾ BIẾN LÂM SẢN XUẤT KHẨU PHÚ MỸ THÀNH
-1,"DAI QUANG INTERIOR CO.,LTD",CÔNG TY TRÁCH NHIỆM HỮU HẠN SẢN XUẤT THƯƠNG MẠI NỘI THẤT ĐẠI QUANG
-1,-1,CÔNG TY CỔ PHẦN THƯƠNG MẠI DỊCH VỤ SƠN THÀNH
CÔNG TY TNHH MTV XD DV TM ĐỨC KIÊN,CÔNG TY TNHH MTV XD DV TM ĐỨC KIÊN,CÔNG TY TNHH MỘT THÀNH VIÊN XÂY DỰNG DỊCH VỤ THƯƠNG MẠI ĐỨC KIÊN
-1,CTY TNHH TM DV VT XD HOàNG ANH PHáT,Công Ty TNHH Thương Mại Dịch Vụ Vận Tải Xây Dựng Hoàng Anh Phát
PG HANOI,PG HANOI,CÔNG TY TNHH THƯƠNG MẠI VÀ XÂY DỰNG PG HÀ NỘI
SAKUDA INTERNATIONAL JOINT STOCK COMPANY,SAKUDA INTERNATIONAL JOINT STOCK COMPANY,CÔNG TY CỔ PHẦN QUỐC TẾ SAKUDA
"TUAN TUNG CO ., LTD","TUAN TUNG CO ., LTD",CÔNG TY TNHH TUẤN TÙNG
"SPICE ISLAND HOLDINGS CO.,LTD",Spice Island Holdings Company Limited,Công Ty TNHH Spice Island Holdings
CTY TNHH ĐT PT ĐỊA ỐC HÙNG PHÁT,-1,CÔNG TY TNHH ĐẦU TƯ PHÁT TRIỂN ĐỊA ỐC HÙNG PHÁT
"CBW TECHNICAL SERVICE & EQUIPMENTS CO., LTD",CBW TECHNICAL SERVICE & EQUIPMENTS COMPANY LIMITED,Công Ty TNHH Thiết Bị & Dịch Vụ Kỹ Thuật Cbw
NGOC LONG COMPANY,NGOC LONG COMPANY,CÔNG TY TNHH THƯƠNG MẠI DỊCH VỤ THỦY NGỌC LONG
-1,-1,CÔNG TY TNHH DỊCH VỤ ĐẠI THÀNH HÙNG
-1,-1,CÔNG TY TNHH DỊCH VỤ VIỄN THÔNG TIÊN DU
"MINH DUC MANUFACTURING CO., LTD","MINH DUC MANUFACTURING CO., LTD",CÔNG TY TNHH XÂY DỰNG VÀ SẢN XUẤT THƯƠNG MẠI MINH ĐỨC
"NGAN NGUYEN CO.,LTD","NGAN NGUYEN CO.,LTD",CÔNG TY TNHH ĐẦU TƯ VÀ THƯƠNG MẠI NGÂN NGUYÊN
-1,-1,CÔNG TY TNHH MINH THẮNG
-1,-1,Công Ty TNHH Thương Mại Dịch Vụ Vận Tải Bảo Tín Group
-1,-1,CÔNG TY TNHH MỘT THÀNH VIÊN MẠNG LƯỚI QUÀ
CÔNG TY TNHH MỘT THÀNH VIÊN SẢN XUẤT DƯỢC LIỆU LÂM ĐỒNG,CÔNG TY TNHH MỘT THÀNH VIÊN SẢN XUẤT DƯỢC LIỆU LÂM ĐỒNG,CÔNG TY TNHH MỘT THÀNH VIÊN SẢN XUẤT DƯỢC LIỆU LÂM ĐỒNG
HUY ANH ADVERTISING ONE MEMBER COMPANY LIMITED,HUY ANH ADVERTISING ONE MEMBER COMPANY LIMITED,CÔNG TY TNHH MTV QUẢNG CÁO HUY ANH
-1,-1,CÔNG TY CỔ PHẦN KỸ THUẬT VÀ THƯƠNG MẠI TAM SƠN
CÔNG TY TNHH KD TM TH BẢO TÍN,BAO TIN GENERAL TRADING AND TRADING COMPANY LIMITED,CÔNG TY TNHH KINH DOANH THƯƠNG MẠI TỔNG HỢP BẢO TÍN
-1,VRUTECH VIETNAM TECHNOLOGY JOINT STOCK COMPANY,CÔNG TY CỔ PHẦN CÔNG NGHỆ VRUTECH VIỆT NAM
"HUNG GIA REAL ESTATE SERVICE CO., LTD","HUNG GIA REAL ESTATE SERVICE CO., LTD",CÔNG TY TNHH DỊCH VỤ BẤT ĐỘNG SẢN HƯNG GIA
CATHUNG TRADE SERVICE IMPORT - EXPORT COMPANY LIMITED,CATHUNG TRADE SERVICE IMPORT - EXPORT COMPANY LIMITED,CÔNG TY TNHH THƯƠNG MẠI DỊCH VỤ XUẤT NHẬP KHẨU CÁT HƯNG
ICITY TECHNOLOGY JSC,ICITY TECHNOLOGY JSC,CÔNG TY CỔ PHẦN KỸ THUẬT CÔNG NGHỆ ICITY
"PHUONG ANH GOAT CO.,LTD","PHUONG ANH GOAT CO.,LTD",CÔNG TY TNHH DÊ GIỐNG PHƯƠNG ANH
"LONG BIEN AUTO BUSINESS CO.,LTD","LONG BIEN AUTO BUSINESS CO.,LTD",CÔNG TY TNHH THƯƠNG MẠI DỊCH VỤ VẬN TẢI VÀ KINH DOANH Ô TÔ LONG BIÊN
-1,-1,CÔNG TY CỔ PHẦN HỮU LỢI
),),CÔNG TY TNHH CHÈ THÁI HƯNG
-1,-1,CÔNG TY TNHH SẢN XUẤT THƯƠNG MẠI HỒN SẮT VIỆT
CTY TNHH MTV GẠCH THÁI ÂN,CTY TNHH MTV GẠCH THÁI ÂN,CÔNG TY TNHH MỘT THÀNH VIÊN GẠCH THÁI ÂN
"THANH AN VIET NAM CONSTRUCTION AND TRADING CO., LTD","THANH AN VIET NAM CONSTRUCTION AND TRADING CO., LTD",CÔNG TY TNHH XÂY DỰNG VÀ THƯƠNG MẠI THÀNH AN VIỆT NAM
"THANHAN XT CO.,LTD","THANHAN XT CO.,LTD",CÔNG TY TNHH XD VÀ TM THÀNH AN
ABB COMPANY LTD,Abb Asia Company Limited,Công Ty TNHH Abb Châu Á
HUU CONG INVESTMENT TRADING COMPANY LIMITED,HUU CONG INVESTMENT TRADING COMPANY LIMITED,CÔNG TY TNHH ĐẦU TƯ THƯƠNG MẠI HỮU CÔNG
-1,-1,CÔNG TY TNHH TRẦN LAN LS
"FAIREST CO., LTD","FAIREST CO., LTD",CÔNG TY TNHH MỘT THÀNH VIÊN CÔNG BẰNG NHẤT
MINH PHU TRADING DEVELOPMENT AND CONSTRUCTION CONSULTING CO,MINH PHU TRADING DEVELOPMENT AND CONSTRUCTION CONSULTING CO,CÔNG TY TNHH TƯ VẤN XÂY DỰNG VÀ PHÁT TRIỂN THƯƠNG MẠI MINH PHÚ
"HA NOI EXPRESS & TECH SOLUTION CO.,LTD","HA NOI EXPRESS & TECH SOLUTION CO.,LTD",CÔNG TY TNHH GIẢI PHÁP CÔNG NGHỆ VÀ CHUYỂN PHÁT NHANH HÀ NỘI
"VICA VN CO.,LTD","VICA VN CO.,LTD",CÔNG TY TNHH VICA VIỆT NAM
-1,-1,CÔNG TY TNHH PADMAC VIỆT NAM
"APTHAIHOA CO.,LTD","APTHAIHOA CO.,LTD",CÔNG TY TNHH NÔNG NGHIỆP ẤP THÁI HÒA
DUC LOC TRADING GENERAL SERVICE COMPANY LIMITED,DUC LOC TRADING GENERAL SERVICE COMPANY LIMITED,CÔNG TY TNHH THƯƠNG MẠI VÀ DỊCH VỤ TỔNG HỢP ĐỨC LỘC
HOA PHAT AGRICULTURE DEVELOPMENT JOINT STOCK COMPANY,HOA PHAT AGRICULTURE DEVELOPMENT JOINT STOCK COMPANY,CÔNG TY CỔ PHẦN PHÁT TRIỂN NÔNG NGHIỆP HÒA PHÁT
SAOKHUE HIGH TECHNOLOGY COMPANY LIMITED,SAOKHUE HIGH TECHNOLOGY COMPANY LIMITED,CÔNG TY TNHH CÔNG NGHỆ CAO SAO KHUÊ
-1,-1,CÔNG TY TNHH MTV CƠ KHÍ XÂY DỰNG & TM LÊ NA
-1,-1,CÔNG TY TNHH PHÁT TRIỂN THƯƠNG MẠI HOÀ BÌNH
"CUC PHUONG TECH CO., LTD","CUC PHUONG TECH CO., LTD",CÔNG TY TNHH ỨNG DỤNG KHOA HỌC KỸ THUẬT CÚC PHƯƠNG
"THUY TRUC EXPORT CO.,LTD","THUY TRUC EXPORT CO.,LTD",CÔNG TY TNHH XUẤT KHẨU THỦY TRÚC
QUY NHON GREEN ARCHITECTURE COMPANY LIMITED,QUY NHON GREEN ARCHITECTURE COMPANY LIMITED,CÔNG TY TNHH KIẾN TRÚC XANH QUY NHƠN
A GREEN GREEN TREE LIMITED COMPANY,A GREEN GREEN TREE LIMITED COMPANY,CÔNG TY TNHH CÁI CÂY XANH XANH
-1,-1,CÔNG TY TNHH NAM HOÀNG PHƯƠNG
-1,"ANNA PRODUCTION SERVICES TRADING CO., LTD",Công Ty TNHH Thương Mại Dịch Vụ Sản Xuất Anna
BIEN DONG TRADING AND PRODUCTION INVESTMENT COMPANY LIMITED,BIEN DONG TRADING AND PRODUCTION INVESTMENT COMPANY LIMITED,CÔNG TY TNHH ĐẦU TƯ SẢN XUẤT VÀ THƯƠNG MẠI BIỂN ĐÔNG
-1,-1,CÔNG TY TNHH SẢN XUẤT LAN TRƯỜNG
"ANH DUNG INDUSTRY., JSC",Anh Dung Industry Joint Stock Company,Công Ty Cổ Phần Công Nghiệp Anh Dũng
LONG PHAT QUANG COMPANY LIMITED,LONG PHAT QUANG COMPANY LIMITED,CÔNG TY TNHH MỘT THÀNH VIÊN LONG PHÁT QUANG
SALICORNIA,SALICORNIA NGON BIEN JOINT STOCK COMPANY,CÔNG TY CỔ PHẦN SALICORNIA NGÓN BIỂN
"PHUONG DONG TOUR CO.,LTD","PHUONG DONG TOUR CO.,LTD",CÔNG TY TNHH MỘT THÀNH VIÊN PHƯƠNG ĐÔNG TOUR
-1,BEE TREE COMPANY LIMITED,CÔNG TY TNHH BEE TREE
-1,-1,CÔNG TY TNHH TMDV VẠN TÍN PHÁT
PRESCO PRODUCE,PRESCO PRODUCE,CÔNG TY TNHH PRESCO PRODUCE
-1,-1,CÔNG TY CỔ PHẦN XÂY DỰNG & PHÁT TRIỂN NĂNG LƯỢNG QUANG CƯỜNG
-1,-1,CÔNG TY TNHH LA PARTY VIỆT NAM
-1,-1,CÔNG TY TNHH THƯƠNG MẠI DỊCH VỤ HOÀNG TRỌNG NAM
CÔNG TY CHẾ TẠO MÁY HẢI LONG,Hai Long Mechanical Machinery Manufacturing Limited Liability Company,Công Ty TNHH Cơ Khí Chế Tạo Máy Hải Long
-1,-1,CÔNG TY TNHH XĂNG DẦU THÂN MẾN
CÔNG TY TNHH CN&TB MT NGHỆ TĨNH,CÔNG TY TNHH CN&TB MT NGHỆ TĨNH,CÔNG TY TRÁCH NHIỆM HỮU HẠN CÔNG NGHỆ VÀ THIẾT BỊ MÔI TRƯỜNG NGHỆ TĨNH
-1,Công Ty TNHH Thương Mại Dịch Vụ Thiên Lãm,Công Ty TNHH Thương Mại Dịch Vụ Thiên Lãm
HKL VINA LIMITED COMPANY,HKL VINA LIMITED COMPANY,CÔNG TY TNHH HKL VINA
"SAVICO.,LTD","SAVICO.,LTD",CÔNG TY TNHH THƯƠNG MẠI VÀ KỸ THUẬT CƠ ĐIỆN SAO VIỆT
-1,"NHAT MINH MED CO.,LTD",CÔNG TY TNHH THIẾT BỊ VẬT TƯ Y TẾ NHẬT MINH
-1,-1,CÔNG TY TNHH TIẾN THÀNH TIẾN
"TRUONG LOC TTAS., JSC","TRUONG LOC TTAS., JSC",CÔNG TY CỔ PHẦN CHUYỂN GIAO CÔNG NGHỆ VÀ DỊCH VỤ TRƯỜNG LỘC
-1,-1,CÔNG TY CỔ PHẦN TƯ VẤN VÀ ĐẦU TƯ TÂN PHONG
-1,-1,CÔNG TY TNHH SẢN XUẤT VÀ THƯƠNG MẠI CÁT THÁI - CHI NHÁNH LMX
-1,-1,CÔNG TY TNHH THƯƠNG MẠI VÀ DỊCH VỤ VẬN TẢI TUYẾT LAN
-1,-1,CÔNG TY CỔ PHẦN ĐẦU TƯ THƯƠNG MẠI VÀ DỊCH VỤ KỸ THUẬT H&T VIỆT NAM
-1,-1,CÔNG TY TNHH NHÀ HÀNG H.Q ĂN NGON
"NHAT PHUONG COMPUTER CO.,LTD","NHAT PHUONG COMPUTER CO.,LTD",CÔNG TY TNHH TIN HỌC NHẬT PHƯƠNG
-1,-1,CÔNG TY INABATA JAPAN
CÔNG TY TRÁCH NHIỆM HỮU HẠN KIẾN TRÚC VÀ NỘI THẤT HL DESIGN,CÔNG TY TRÁCH NHIỆM HỮU HẠN KIẾN TRÚC VÀ NỘI THẤT HL DESIGN,CÔNG TY TRÁCH NHIỆM HỮU HẠN KIẾN TRÚC VÀ NỘI THẤT HL DESIGN
"TILATRAVEL CO.,LTD",TILATRAVEL TOURISM SERVICES AND TRADING DEVELOPMENTAL COMPANY LIMITED,Công Ty TNHH Dịch Vụ Du Lịch Và Phát Triển Thương Mại Tilatravel
-1,-1,Công Ty TNHH Lê Hoàng T&t
-1,-1,CÔNG TY TNHH MTV DŨNG NGA LẠNG SƠN
-1,-1,CÔNG TY TNHH MỘT THÀNH VIÊN THƯƠNG MẠI VẬN TẢI PHÚC CƯỜNG PHÁT
CÔNG TY TNHH M-H,CÔNG TY TNHH M-H,CÔNG TY TNHH MỘT THÀNH VIÊN M-H
CÔNG TY TNHH BĐS PHÁT THỊNH VƯỢNG,-1,Công Ty TNHH Bất Động Sản Phát Thịnh Vượng
-1,-1,CÔNG TY TNHH MTV MẠNH KIÊN
BẢO TÍN BTG,Bao Tin Btg Joint Stock Company,Công Ty Cổ Phần Bảo Tín Btg
-1,-1,CÔNG TY TNHH ANH ĐỨC TỈNH ĐIỆN BIÊN
-1,"DL MECO.,JSC","CÔNG TY TNHH CƠ KHÍ, XÂY LẮP VÀ THƯƠNG MẠI DL"
"CTY HA NOI CO., LTD","CTY HA NOI CO., LTD",CÔNG TY TRÁCH NHIỆM HỮU HẠN PHÁT TRIỂN DỊCH VỤ THUỶ SẢN HẢI ĐĂNG
CTY TNHH TM KD BĐS ĐẠI PHÁT,CTY TNHH TM KD BDS DAI PHAT,CÔNG TY TNHH THƯƠNG MẠI KINH DOANH BẤT ĐỘNG SẢN ĐẠI PHÁT
-1,DINH CAO EDU JSC,CÔNG TY CỔ PHẦN GIÁO DỤC ĐỈNH CAO
"HONG HA TECHNOLOGY SCIENCE MATERIAL, MEDICAL EQUIPMENT COMPANY LIMITED","HONG HA TECHNOLOGY SCIENCE MATERIAL, MEDICAL EQUIPMENT COMPANY LIMITED","CÔNG TY TNHH THIẾT BỊ Y TẾ, VẬT TƯ KHOA HỌC KỸ THUẬT HỒNG HÀ"
-1,-1,CÔNG TY TNHH SONG TRIỆU
"THIEN AN CONNECT SERVICES TRADING CO.,LTD","THIEN AN CONNECT SERVICES TRADING CO.,LTD",CÔNG TY TNHH THƯƠNG MẠI DỊCH VỤ KẾT NỐI THIÊN ÂN
NHUAN PHAT SX & TM COMPANY LIMITED,NHUAN PHAT SX & TM COMPANY LIMITED,CÔNG TY TNHH SX &AMP; TM NHUẬN PHÁT
-1,-1,Công Ty TNHH Đầu Tư Thương Mại Du Lịch Thời P Thịnh
HONG LINH HD COMPANY LIMITED),HONG LINH HD COMPANY LIMITED),CÔNG TY TNHH HỒNG LĨNH HD
"MINH TRAM TRADING & MANUFACTURING CO.,LTD",Minh Tram Trading & Manufacturing Company Limited,Công Ty TNHH Thương Mại & Sản Xuất Minh Trâm
TM VINA COMPANY LIMITED,TM VINA COMPANY LIMITED,CÔNG TY TNHH TM VINA
-1,-1,CÔNG TY CỔ PHẦN XÂY DỰNG CÔNG TRÌNH 6 YÊN BÁI
MINH PHUOC CONSTRUCTION AND SERVICES COMPANY LIMITED,MINH PHUOC CONSTRUCTION AND SERVICES COMPANY LIMITED,CÔNG TY TNHH XÂY DỰNG VÀ DỊCH VỤ MINH PHƯỚC
"LUXURY TRAVEL CO .,LTD","LUXURY TRAVEL CO .,LTD",CÔNG TY TNHH DU LỊCH SANG TRỌNG VIỆT NAM
URBANCONS,URBANCONS,CÔNG TY CỔ PHẦN URBAN CONSTRUCTION
-1,-1,CÔNG TY TNHH ĐẦU TƯ THƯƠNG MẠI ĐINH HƯƠNG
"HUNG DIEP ONE MEMBER CO., LTD","HUNG DIEP ONE MEMBER CO., LTD",CÔNG TY TNHH MỘT THÀNH VIÊN HƯNG ĐIỆP
"NAM HOA LU CO.,LTD","NAM HOA LU CO.,LTD",CÔNG TY TNHH MỘT THÀNH VIÊN NAM HOA LƯ
-1,-1,CÔNG TY TNHH ĐẦU TƯ VÀ PHÁT TRIỂN NGUYÊN DƯƠNG
-1,-1,Công Ty TNHH Nhà Ở New Land
THANH TUNG PRODUCING TRADING CO.LTD,THANH TUNG PRODUCING TRADING CO.LTD,CÔNG TY SẢN XUẤT - THƯƠNG MẠI THANH TÙNG
"ANH GIA KHANH CO.,LTD","ANH GIA KHANH CO.,LTD",CÔNG TY TNHH ĐẦU TƯ ANH GIA KHÁNH
-1,-1,CÔNG TY TNHH TMDV CÔNG NGHỆ - VIỄN THÔNG SÔNG TRĂNG
-1,-1,CÔNG TY TNHH TRANG TRÍ NỘI THẤT NAM TIẾN
THIEN HOANG PHU COMPANY LIMITED,THIEN HOANG PHU COMPANY LIMITED,CÔNG TY TNHH THIÊN HOÀNG PHÚ
CÔNG TY MTV SUỐI BÙN NẤM LIM,CÔNG TY MTV SUỐI BÙN NẤM LIM,CÔNG TY TNHH MỘT THÀNH VIÊN SUỐI BÙN NẤM LIM
-1,-1,CÔNG TY TNHH ĐẦU TƯ KITA KIẾN HƯNG PHÁT
"INTAD CO.,LTD","INTAD CO.,LTD",CÔNG TY TNHH ĐẦU TƯ PHÁT TRIỂN VÀ ỨNG DỤNG CÔNG NGHỆ QUỐC TẾ
DAI LOC STUDY ABROAD CONSULTING AND INTERNATIONAL SERVICE CO,DAI LOC STUDY ABROAD CONSULTING AND INTERNATIONAL SERVICE CO,CÔNG TY TNHH TƯ VẤN DU HỌC VÀ DỊCH VỤ QUỐC TẾ ĐẠI LỘC
THINH HUNG PHARMACEUTICALS COMPANY LIMITED,THINH HUNG PHARMACEUTICALS COMPANY LIMITED,CÔNG TY TNHH DƯỢC PHẨM THỊNH HƯNG
-1,-1,CÔNG TY TNHH PHÁT TRIỂN ĐÔ THỊ MỸ HƯNG
