brief_name,eng_name,name
"S-MOBILE .,JSC","S-MOBILE .,JSC",CÔNG TY CỔ PHẦN GIẢI PHÁP DI ĐỘNG THÔNG MINH
-1,-1,CÔNG TY TNHH TRANG TRÍ NỘI THẤT HỒNG CÔNG
-1,VDD JOINT STOCK CO,CÔNG TY CỔ PHẦN RỒNG VIỆT DECOR
"HANOI GIFT., JSC","HANOI GIFT., JSC",CÔNG TY CỔ PHẦN QUÀ TẶNG HÀ NỘI
"H.O.2 CO.,LTD",H.o.2 Company Limited,Công Ty TNHH H.o.2
-1,-1,CÔNG TY TNHH TIẾP VẬN CHL
-1,-1,Công Ty TNHH Sản Xuất Và Thương Mại Tập Hồng
U&A,U&A,CÔNG TY CỔ PHẦN THIẾT KẾ ĐÔ THỊ VÀ KIẾN TRÚC - U&A
"SUNRISE TRAVEL CO.,LTD","SUNRISE TRAVEL CO.,LTD",CÔNG TY TNHH DU LỊCH ÁNH SÁNG BÌNH MINH
HAI DUONG - PHUC THIEN TRADING AND SERVICE JOINT STOCK COMPA,HAI DUONG - PHUC THIEN TRADING AND SERVICE JOINT STOCK COMPA,CÔNG TY CỔ PHẦN THƯƠNG MẠI VÀ DỊCH VỤ PHÚC THIÊN - HẢI DƯƠNG
-1,-1,CÔNG TY TNHH ANH HUY QUẢNG NINH
-1,-1,CÔNG TY TNHH PHÚ LỄ
-1,-1,Công Ty Trách Nhiệm Hữu Hạn Đầu Tư Bất Động Sản 5s
-1,-1,CÔNG TY TNHH THƯƠNG MẠI & DỊCH VỤ NAM THANH
"PEACH .,JSC","PEACH .,JSC",CÔNG TY CỔ PHẦN DỊCH VỤ VÀ TRUYỀN THÔNG PEACH
-1,HUNG PHUC.JSC,CÔNG TY CP TƯ VẤN ĐẦU TƯ VÀ XÂY DỰNG HƯNG PHÚC
-1,-1,CÔNG TY TNHH CHỐNG THẤM NHÀ ĐẸP ĐÀ LẠT
VITHAHO INDUSTRY DEVELOPMENT INFRASTRUCTURE CONSTRUCTION INVESTMENT JOINT STOCK COMPANY,VITHAHO INDUSTRY DEVELOPMENT INFRASTRUCTURE CONSTRUCTION INVESTMENT JOINT STOCK COMPANY,CÔNG TY CỔ PHẦN ĐẦU TƯ XÂY DỰNG PHÁT TRIỂN HẠ TẦNG CÔNG NGHIỆP VITHAHO
-1,-1,CÔNG TY TNHH CÔNG NGHỆ TÍN THỊNH
"BAO MINH INTER IN CO., LTD)","BAO MINH INTER IN CO., LTD)",CÔNG TY TNHH ĐẦU TƯ QUỐC TẾ BẢO MINH
-1,-1,CÔNG TY TNHH HẠT DINH DƯỠNG NUNUTS
"GOLDEN MAP TOUR CO., LTD","GOLDEN MAP TOUR CO., LTD",CÔNG TY TNHH DU LỊCH QUỐC TẾ BẢN ĐỒ VÀNG
-1,LUXUBU SERVICE TRADING COMPANY LIMITED,CÔNG TY TNHH THƯƠNG MẠI DỊCH VỤ LUXUBU
-1,-1,CÔNG TY TNHH DU LỊCH VUI & TỔ CHỨC SỰ KIỆN
-1,-1,CÔNG TY TNHH IN VÀ THƯƠNG MẠI HẢI PHONG
-1,Ai Urban Environment Investment Joint Stock Company,Công Ty Cổ Phần Đầu Tư Môi Trường Đô Thị Ai
"TAYACO CO.,LTD",TAYACO COMPANY LIMITED,CÔNG TY TNHH TAYACO
-1,-1,CÔNG TY TNHH TM & XD THẢO MINH PHÁT
-1,Sunny One Member Company Limited,Công Ty TNHH Một Thành Viên Miền Ánh Nắng
-1,"TANG NGHI LUC CO.,LTD",CÔNG TY TRÁCH NHIỆM HỮU HẠN MỘT THÀNH VIÊN TĂNG NGHỊ LỰC
"MINH PHU THANG CO.,LTD","MINH PHU THANG CO.,LTD",CÔNG TY TNHH MINH PHÚ THĂNG
THANH TIEN INCO,THANH TIEN INCO,CÔNG TY TNHH ĐẦU TƯ THÀNH TIẾN
"LE BAO PHUONG CO., LTD","LE BAO PHUONG CO., LTD",CÔNG TY TNHH MTV LÊ BẢO PHƯƠNG
OTRAN LOGISTICS JSC,OTRAN LOGISTICS JOINT STOCK COMPANY,CÔNG TY CỔ PHẦN OTRAN LOGISTICS
"TAKASHI CO., LTD",TAKASHI INVESTMENT TRADING PRODUCTION AND TRAVEL LIMITED COMPANY,CÔNG TY TNHH ĐẦU TƯ THƯƠNG MẠI SẢN XUẤT VÀ DU LỊCH TAKASHI
VN.ETC,Viet Nam Electrical Testing One Member Company Limited,Công Ty TNHH Một Thành Viên Thí Nghiệm Điện Việt Nam
-1,-1,CÔNG TY TNHH MỘT THÀNH VIÊN TRẦN THỊ TỐT
-1,-1,CÔNG TY TNHH MỘT THÀNH VIÊN THIỆN NHƠN - BC
-1,-1,CÔNG TY TNHH MTV KHÁCH SẠN DU LỊCH CÔNG ĐOÀN HẠ LONG NỘP THUẾ THAY NHÀ THẦU NƯỚC NGOÀI
NHIP SONG XANH FOODS,Nhip Song Xanh Foods Company Limited,Công Ty TNHH Thực Phẩm Nhịp Sống Xanh
"HOANG GIA SOLAR GROUP CO .,LTD",HOANG GIA SOLAR GROUP COMPANY LIMITED,CÔNG TY TNHH TẬP ĐOÀN HOÀNG GIA SOLAR
SNF JSC,SNF JSC,CÔNG TY CỔ PHẦN THỰC PHẨM DINH DƯỠNG SÀI GÒN
C.TY TNHH MTV BLUE TAXI,Công Ty TNHH Mtv Blue Taxi,Công Ty TNHH Mtv Blue Taxi
CLOUD DATA COMPANY LIMITED,CLOUD DATA COMPANY LIMITED,CÔNG TY TNHH DỮ LIỆU ĐÁM MÂY
-1,-1,CÔNG TY CỔ PHẦN PHÁT TRIỂN CÔNG NGHỆ HƯNG PHÚ JEAN
-1,-1,CÔNG TY TNHH SX KINH DOANH THIẾT BỊ Y TẾ HÒA XUÂN- CHI NHÁNH BÌNH TÂN
-1,-1,CÔNG TY CỔ PHẦN TƯ VẤN XÂY DỰNG NAM Á
LINH VUONG SERVICE TRADING COMPANY LIMITED,LINH VUONG SERVICE TRADING COMPANY LIMITED,CÔNG TY TNHH THƯƠNG MẠI DỊCH VỤ LINH VƯƠNG
-1,"NHÂN PHÚ CO., LTD (TÊN CŨ: CÔNG TY TNHH XÂY DỰNG NHÂN PHÚ)",CÔNG TY TNHH XÂY DỰNG & THƯƠNG MẠI NHÂN PHÚ
VIET NAM HKLC TECHNICAL TECHNOLOGY DEVICE LIMITED COMPANY,VIET NAM HKLC TECHNICAL TECHNOLOGY DEVICE LIMITED COMPANY,CÔNG TY TNHH THIẾT BỊ CÔNG NGHỆ KỸ THUẬT HKLC VIỆT NAM
"HQT INVESTMENT CO.,LTD","HQT INVESTMENT CO.,LTD",CÔNG TY TRÁCH NHIỆM HỮU HẠN ĐẦU TƯ THƯƠNG MẠI VÀ DỊCH VỤ HƯNG QUANG THỊNH
-1,-1,CÔNG TY CỔ PHẦN THƯƠNG MẠI VÀ DỊCH VỤ KỸ THUẬT THÀNH ĐẠT
CÔNG TY TNHH MTV DUY TUYẾN,Công Ty TNHH Mtv Duy Tuyến,Công Ty TNHH Mtv Duy Tuyến
-1,-1,CÔNG TY TNHH SUPERSHIP THÁI BÌNH - CHI NHÁNH KIẾN XƯƠNG
-1,-1,CÔNG TY TNHH PHÚC LÂM NGUYÊN
"PHU GIA HUNG INVESTMENT, TRADING SERVICE COMPANY LIMITED","PHU GIA HUNG INVESTMENT, TRADING SERVICE COMPANY LIMITED","CÔNG TY TNHH DỊCH VỤ THƯƠNG MẠI, ĐẦU TƯ PHÚ HƯNG GIA"
DEVELOPMENT ELECTRICAL ENERGY JOINT STOCK CPMPANY,DEVELOPMENT ELECTRICAL ENERGY JOINT STOCK CPMPANY,CÔNG TY CỔ PHẦN PHÁT TRIỂN ĐIỆN NĂNG
CTY TNHH ĐT BĐS NGỌC HÀ,CTY TNHH ĐT BĐS NGọC Hà,CÔNG TY TNHH ĐẦU TƯ BẤT ĐỘNG SẢN NGỌC HÀ
NORTH ATLANTIC SERVICE JOINT STOCK COMPANY,NORTH ATLANTIC SERVICE JOINT STOCK COMPANY,CÔNG TY CỔ PHẦN DỊCH VỤ BẮC ĐẠI TÂY DƯƠNG
-1,-1,CÔNG TY TNHH MỘT THÀNH VIÊN DỊCH VỤ VÀ VẬN TẢI XĂNG DẦU QUỐC DUY
-1,-1,CÔNG TY CỔ PHẦN MÔI GIƠÍ BẢO HIỂM Á ĐÔNG
"LE TUAN PHAT CO.,LTD","LE TUAN PHAT CO.,LTD",CÔNG TY TNHH MTV LÊ TUẤN PHÁT
-1,-1,CÔNG TY CỔ PHẦN ĐẦU TƯ DU LỊCH QUỐC TẾ VIETVIPTUOR HOÀNG SƠN
-1,-1,CÔNG TY TNHH TIN HỌC BUÔN MA THUỘT-IT
TNC,TNC,CÔNG TY CỔ PHẦN TƯ VẤN XÂY DỰNG THANH NAM
DUC MINH JSC,DUC MINH JSC,CÔNG TY CỔ PHẦN ĐỨC MINH
"PCCA HOANG PHAT TSP CO.,LTD",PCCA HOANG PHAT TRADING - SERVICER - PRODUCTION COMPANY LIMITED,CÔNG TY TNHH THƯƠNG MẠI - DỊCH VỤ - SẢN XUẤT PCCA HOÀNG PHÁT
"QUY THANH TRADING CO., LTD","QUY THANH TRADING CO., LTD",CÔNG TY TNHH SẢN XUẤT THƯƠNG MẠI DỊCH VỤ VÀ XUẤT NHẬP KHẨU QUÝ THÀNH
-1,-1,CÔNG TY TNHH MỘT THÀNH VIÊN ĐIỆN TỬ VIỄN THÔNG CHÂU ANH
-1,-1,CÔNG TY TNHH MỘT THÀNH VIÊN PHẠM NGỌC SANG
"UNIGAR CO., LTD","UNIGAR CO., LTD",CÔNG TY TNHH MỘT THÀNH VIÊN UNIGAR
-1,-1,CÔNG TY CỔ PHẦN ĐẦU TƯ VÀ PHÁT TRIỂN GIÁO DỤC QUỐC TẾ ONLY SPEAKING
-1,NHAT TAN TIEN PHAT TRADING PRODUCTION COMPANY LIMITED,CÔNG TY TNHH THƯƠNG MẠI XUẤT NHẬP KHẨU LONG GIANG
VIET UC VENTURE PHARMACEUTICAL JOINT STOCK COMPANY,Viet Uc Venture Pharmaceutical Joint Stock Company,Công Ty Cổ Phần Liên Doanh Dược Phẩm Việt Úc
HOANG PHUONG COMPANY LIMITED,HOANG PHUONG COMPANY LIMITED,CÔNG TY TNHH HOÀNG PHƯƠNG
-1,"QUANG DUNG MS CO.,LTD",CÔNG TY TNHH DỊCH VỤ SẢN XUẤT QUANG DŨNG
-1,-1,CÔNG TY TNHH CHĂN NUÔI MINH PHÁT HƯNG
-1,DINH GIA TRADING SERVICE AND PRODUCE INVESTMENT JOINT STOCK,CÔNG TY CỔ PHẦN ĐẦU TƯ SẢN XUẤT VÀ DỊCH VỤ THƯƠNG MẠI ĐINH GIA
-1,-1,CÔNG TY TRÁCH NHIỆM HỮU HẠN THƯƠNG MẠI XUẤT NHẬP KHẨU TRÚC SANG
),),CÔNG TY TRÁCH NHIỆM HỮU HẠN LÊ PHẠM - CHI NHÁNH TẠI HÀ TĨNH
"NHAT LINH ECOM., JSC","NHAT LINH ECOM., JSC",CÔNG TY CỔ PHẦN THƯƠNG MẠI ĐIỆN TỬ VÀ DỊCH VỤ TRỰC TUYẾN STAR NEW
-1,"DITRA CO., LTD",CÔNG TY TNHH ĐIỀN TRANG
-1,-1,CÔNG TY TNHH THƯƠNG MẠI DỊCH VỤ VƯƠNG AN
"OPODISPHARMACEUTICAL CO., LTD","OPODISPHARMACEUTICAL CO., LTD",CÔNG TY TNHH DƯỢC PHẨM-DƯỢC LIỆU OPODIS
-1,-1,CÔNG TY TNHH ĐẠI HƯNG
"NONG VIET PRODUCTION TRADING DEVELOPMENT CO., LTD","NONG VIET PRODUCTION TRADING DEVELOPMENT CO., LTD",CÔNG TY TNHH PHÁT TRIỂN THƯƠNG MẠI SẢN XUẤT NÔNG VIỆT
"KIM QUE PETROL CO.,LTD","KIM QUE PETROL CO.,LTD",CÔNG TY TNHH XĂNG DẦU KIM QUẾ
"THE VENTURES CO.,LTD","THE VENTURES CO.,LTD",CÔNG TY TNHH VĨ NGÔN LỄ
-1,SRK - HV,CÔNG TY TNHH TOKAI RUBBER HOSE VIỆT NAM
-1,-1,CÔNG TY CỔ PHẦN TƯ VẤN ĐẦU TƯ THIẾT KẾ VÀ CÔNG NGHỆ XÂY DỰNG VIỆT NAM
-1,-1,CÔNG TY TNHH LÂM HOÀI KHANH
-1,THIEN MINH PHAT PRODUCTION TRADING SERVICE COMPANY LIMITED,CÔNG TY TNHH DỊCH VỤ THƯƠNG MẠI SẢN XUẤT THIÊN MINH PHÁT
-1,-1,CÔNG TY TNHH MỘT THÀNH VIÊN DỊCH VỤ TRUYỀN THÔNG PHD
-1,-1,CÔNG TY TNHH SẢN XUẤT KINH DOANH MỸ NHẬT
"DUNG PHAT DAT CO.,LTD","DUNG PHAT DAT CO.,LTD",CÔNG TY TNHH CỬA ĐẸP DŨNG PHÁT ĐẠT
"KHKT THAI DUONG CO., LTD","KHKT THAI DUONG CO., LTD",CÔNG TY TNHH MTV THÔNG TIN KHKT THÁI DƯƠNG
-1,"HUNG THINH EQUIPMENT CO., LTD",CÔNG TY TNHH THIẾT BỊ KHOA HỌC KỸ THUẬT HƯNG THỊNH
CÔNG TY CP TV ĐT & XD ACB,CÔNG TY CP TV ĐT & XD ACB,CÔNG TY CP TƯ VẤN ĐẦU TƯ VÀ XÂY DỰNG ACB
"GIANG HAI CO.,LTD","GIANG HAI CO.,LTD",CÔNG TY TNHH THƯƠNG MẠI DỊCH VỤ GIANG HẢI
-1,-1,CÔNG TY TNHH KIM PHƯỚC NHA TRANG
-1,-1,Công Ty TNHH Quán Ăn Gia Đình 347
-1,-1,CÔNG TY CỔ PHẦN ĐẦU TƯ XÂY DỰNG 139
-1,Công Ty Cổ Phần Thiết Bị Công Trình Thịnh Nguyên Việt Nam,Công Ty Cổ Phần Thiết Bị Công Trình Thịnh Nguyên Việt Nam
CÔNG TY ĐẦU TƯ PHÁT TRIỂN LẠC SƠN,CÔNG TY ĐẦU TƯ PHÁT TRIỂN LẠC SƠN,CÔNG TY CỔ PHẦN ĐẦU TƯ PHÁT TRIỂN LẠC SƠN
-1,-1,CÔNG TY TNHH THƯƠNG MẠI DỊCH VỤ TRƯỜNG LÂM
-1,-1,CÔNG TY TNHH DỊCH VỤ VIỄN THÔNG TRƯỜNG LỘC PHÁT
-1,-1,CÔNG TY TNHH THƯƠNG MẠI DỊCH VỤ SẢN XUẤT YẾN SÀO PHƯƠNG LAN CHI
PARKING EXPLOIT & INVESTMENT COMPANY LIMITED,PARKING EXPLOIT & INVESTMENT COMPANY LIMITED,CÔNG TY TNHH ĐẦU TƯ &AMP; KHAI THÁC PARKING
"PHÚ THÀNH.,JSC","PHÚ THÀNH.,JSC",CÔNG TY CP ĐẦU TƯ KINH DOANH TỔNG HỢP PHÚ THÀNH
"T&VUI CO.,LTD","T&VUI CO.,LTD",CÔNG TY TNHH MỘT THÀNH VIÊN CÔNG NGHỆ VÀ DỊCH VỤ T & VUI
-1,HAPPY MEAL VIET NAM TRADING AND SERVICE COMPANY LIMITED,Công Ty TNHH Thương Mại Và Dịch Vụ Happy Meal Việt Nam
-1,-1,CÔNG TY TRÁCH NHIỆM HỮU HẠN THUÝ HUYỀN
-1,-1,CÔNG TY TNHH HÙNG DŨNG
-1,-1,CÔNG TY TNHH TRƯỜNG TÍN
TRUONG ANH JOINT STOCK COMPANY,TRUONG ANH JOINT STOCK COMPANY,CÔNG TY CỔ PHẦN TRƯỜNG ANH
LEVERBUZ,LEVERBUZ,CÔNG TY CỔ PHẦN LEVERBUZ
-1,-1,CÔNG TY TNHH TƯ VẤN - XÂY DỰNG THƯƠNG MẠI VẠN THÀNH
LONG THINH PHAT WOOD COMPANY LIMITED,LONG THINH PHAT WOOD COMPANY LIMITED,CÔNG TY TNHH GỖ LONG THỊNH PHÁT
HABD EXIM JS CO,HABD EXIM JS CO,CÔNG TY CỔ PHẦN XUẤT NHẬP KHẨU HOÀNG ANH BÌNH DƯƠNG
"COPLAN., JSC","COPLAN., JSC",CÔNG TY CỔ PHẦN COPLAN
-1,VINAVIT CORP,CÔNG TY CỔ PHẦN SẢN XUẤT -THƯƠNG MẠI VĨ NAM VIỆT
"KIEN VINH KHANG DAC CO., LTD","KIEN VINH KHANG DAC CO., LTD",CÔNG TY TNHH THIẾT KẾ VÀ XÂY DỰNG KIẾN VINH KHANG
EAST ASIA CO,EAST ASIA CO,CÔNG TY CỔ PHẦN ĐÔNG Á
-1,-1,CÔNG TY CỔ PHẦN XÂY LẮP ĐIỆN TIẾN LÊN
-1,-1,CÔNG TY TRÁCH NHIỆM HỮU HẠN SONG NGỌC
-1,-1,"CÔNG TY TNHH THƯƠNG MẠI, XÂY DỰNG ĐẠI ĐỒNG"
DUC MINH PORCELAIN POTTERY COMPANY LIMITED,DUC MINH PORCELAIN POTTERY COMPANY LIMITED,CÔNG TY TNHH GỐM SỨ ĐỨC MINH
NÔNG SẢN NGUYỄN HOÀNG,NONG SAN NGUYEN HOANG,CÔNG TY TNHH CHẾ BIẾN & XUẤT NHẬP KHẨU NÔNG SẢN NGUYỄN HOÀNG
"H&T ETHP CO.,LTD","H&T ETHP CO.,LTD",CÔNG TY TNHH KHÍ NÉN - THỦY LỰC- KỸ THUẬT ĐIỆN H&T
-1,-1,CÔNG TY TNHH MAY MINH HOÀNG PHÁT
-1,VAN SON DEVELOPMENT SERVICE AND TRADING COMPANY LIMITED,CÔNG TY TNHH THƯƠNG MẠI VÀ DỊCH VỤ PHÁT TRIỂN VẠN SƠN
-1,-1,CÔNG TY TNHH THƯƠNG MẠI ĐIỆN TỬ VIỆT THẮNG
"HAI PHONG GREEN SPACE CO.,LTD",HAI PHONG GREEN SPACE SERVICE TRADING COMPANY LIMITED,CÔNG TY TNHH THƯƠNG MẠI DỊCH VỤ KHÔNG GIAN XANH HẢI PHÒNG
LABO VIỆT TIÊN ĐÀ NẴNG,LABO VIỆT TIÊN ĐÀ NẴNG,CÔNG TY TNHH LABO VIỆT TIÊN ĐÀ NẴNG
-1,-1,CÔNG TY TNHH THƯƠNG MẠI- DỊCH VỤ VẬT TƯ VÀ XÂY DỰNG THỌ NHẤT
-1,VAN JSC,CÔNG TY CỔ PHẦN VÂN NAM
"ANH SANG DO THANH CO.,LTD","ANH SANG DO THANH CO.,LTD",CÔNG TY TNHH ÁNH SÁNG ĐÔ THÀNH
-1,-1,CÔNG TY TNHH NGHỆ THUẬT TRÙNG DƯƠNG
CÔNG TY TNHH MTV TM VLXD DUY ĐỨC PHÁT,CONG TY TNHH MTV TM VLXD DUY DUC PHAT,CÔNG TY TNHH MTV THƯƠNG MẠI VẬT LIỆU XÂY DỰNG DUY ĐỨC PHÁT
-1,TRUONG PHAT TRADING AND SERVICE DEVELOPMENT COMPANY LIMITED,Công Ty TNHH Phát Triển Dịch Vụ Và Thương Mại Trường Phát
"CTP., JSC","CTP., JSC",CÔNG TY CỔ PHẦN CAO THANH PHONG
-1,VIET AGRICALTURAL SOLUTION APPLICATION JIONT - STOCK COMPANY,CÔNG TY CỔ PHẦN ỨNG DỤNG GIẢI PHÁP NÔNG NGHIỆP VIỆT
"DIEN CO HOA PHUONG COMPANY.,LTD","DIEN CO HOA PHUONG COMPANY.,LTD",CÔNG TY TNHH ĐIỆN CƠ HOA PHƯỢNG
CÔNG TY TNHH MTV BẢO NGUYÊN LÊ,CÔNG TY TNHH MTV BẢO NGUYÊN LÊ,CÔNG TY TNHH MỘT THÀNH VIÊN BẢO NGUYÊN LÊ
-1,-1,CÔNG TY CP XÂY DỰNG VÀ CÔNG NGHỆ MINH KHÁNH
-1,-1,CÔNG TY TNHH VẠN LAN PHÁT
-1,-1,Công Ty TNHH Cung Ứng Thương Mại Happy Nest
),),CÔNG TY TRÁCH NHIỆM HỮU HẠN NATAKI
-1,HOANG NGAN TM COMPANY LIMITED,CÔNG TY TNHH TM HOÀNG NGÂN
"AU LAC TS CO .,LTD","AU LAC TS CO .,LTD",CÔNG TY TNHH TƯ VẤN CÔNG NGHỆ ÂU LẠC
HELLO ENGLISH LANGUAGE CENTER LIMITED COMPANY,HELLO ENGLISH LANGUAGE CENTER LIMITED COMPANY,CÔNG TY TNHH TRUNG TÂM ANH NGỮ HELLO
-1,KIEN HUNG FURNITURE AND CONSTRUCTION JOINT STOCK COMPANY,CÔNG TY CỔ PHẦN XÂY DỰNG VÀ NỘI THẤT KIẾN HƯNG
-1,-1,CÔNG TY TNHH THƯƠNG MẠI DU LỊCH ĐẠI THÀNH
"DONG TAM AGRICULTURAL IMPORT EXPORT CO.,LTD","DONG TAM AGRICULTURAL IMPORT EXPORT CO.,LTD",CÔNG TY TRÁCH NHIỆM HỮU HẠN XUẤT NHẬP KHẨU NÔNG NGHIỆP ĐỒNG TÂM
DTPT TIENGVANG,TIENG VANG DEVELOPMENT INVESTMENT COMPANY LIMITED,CÔNG TY TNHH ĐẦU TƯ PHÁT TRIỂN TIẾNG VANG
ADP INVESTMENT AND CONSUTANT TRADING COMPANY LIMITED,ADP INVESTMENT AND CONSUTANT TRADING COMPANY LIMITED,CÔNG TY TNHH ĐẦU TƯ VÀ TƯ VẤN THƯƠNG MẠI ADP
AN THAO ELECTRONIC SCALES SERVICE AND TRADE COMPANY LIMITED,AN THAO ELECTRONIC SCALES SERVICE AND TRADE COMPANY LIMITED,CÔNG TY TNHH THƯƠNG MẠI VÀ DỊCH VỤ CÂN ĐIỆN TỬ AN THẢO
-1,-1,CÔNG TY TRÁCH NHIỆM HỮU HẠN THƯƠNG MẠI VÀ XÂY DỰNG KHANG YẾN
CÔNG TY TRÁCH NHIỆM HỮU HẠN ĐỒ GỖ CAO CẤP THANH BẢY,CÔNG TY TRÁCH NHIỆM HỮU HẠN ĐỒ GỖ CAO CẤP THANH BẢY,CÔNG TY TRÁCH NHIỆM HỮU HẠN ĐỒ GỖ CAO CẤP THANH BẢY
-1,-1,CÔNG TY DỊCH VỤ GIAO THÔNG VẬN TẢI (TNHH)
-1,-1,CÔNG TY CỔ PHẦN KINH DOANH THƯƠNG MẠI XUẤT NHẬP KHẨU C&N
KANRA VIET NAM TRADING JOINT STOCK COMPANY,KANRA VIET NAM TRADING JOINT STOCK COMPANY,CÔNG TY CỔ PHẦN THƯƠNG MẠI KANRA VIỆT NAM
CHUONG DUONG STEEL JSC,CHUONG DUONG STEEL JSC,CÔNG TY CỔ PHẦN THÉP CHƯƠNG DƯƠNG
CTY TNHH THANH PHONG VÂN,CTY TNHH THANH PHONG VÂN,CÔNG TY TNHH MỘT THÀNH VIÊN THANH PHONG VÂN
CTY XD NGỌC SƠN,CTY XD NGỌC SƠN,CÔNG TY TNHH MỘT THÀNH VIÊN XÂY DỰNG NGỌC SƠN GIA LAI
-1,-1,CÔNG TY CỔ PHẦN ĐẦU TƯ THƯƠNG MẠI MINH PHƯƠNG QUẢNG NINH - CHI NHÁNH HÀ NỘI
-1,-1,CÔNG TY TNHH MTV XUẤT NHẬP KHẨU VÀ ĐẦU TƯ CHỢ GỖ VIỆT NAM
"CHÁO 25 CO.,LTD",CHAO 25 COMPANY LIMITED,CÔNG TY TNHH CHÁO 25
"VI NA PAINT CO.,LTD","VI NA PAINT CO.,LTD",CÔNG TY TNHH SƠN VI NA
HP TRADE CONSULTANT INVESTMENT JSC,HP TRADE CONSULTANT INVESTMENT JSC,CÔNG TY CỔ PHẦN TƯ VẤN ĐẦU TƯ THƯƠNG MẠI HP
DAVISJ,DAI VIET CONSULTING INVESTMENT SERVICE JOINT STOCK COMPANY,CÔNG TY CỔ PHẦN DỊCH VỤ TƯ VẤN ĐẦU TƯ ĐẠI VIỆT
-1,"PA IMEX CO.,LTD",CÔNG TY TNHH MỘT THÀNH VIÊN THƯƠNG MẠI VÀ DỊCH VỤ XUẤT NHẬP KHẨU PHI ANH
"VTAS GROUP CO., LTD",VTAS GROUP COMPANY LIMITED,CÔNG TY TNHH VTAS GROUP
-1,"THE CUONG INVESTMENT CO.,LTD",CÔNG TY TNHH MỘT THÀNH VIÊN ĐẦU TƯ THẾ CƯỜNG
CÔNG TY TRÁCH NHIỆM HỮU HẠN XÂY DỰNG HỢP THÀNH,CÔNG TY TRÁCH NHIỆM HỮU HẠN XÂY DỰNG HỢP THÀNH,CÔNG TY TRÁCH NHIỆM HỮU HẠN XÂY DỰNG HỢP THÀNH
-1,-1,CÔNG TY TNHH CAO VŨ BẢO PHÁT
HOAN THAI BINH TRADING PRODUCTION COMPANY LIMITED,HOAN THAI BINH TRADING PRODUCTION COMPANY LIMITED,CÔNG TY TNHH SẢN XUẤT THƯƠNG MẠI HOÀN THÁI BÌNH
-1,-1,CÔNG TY CỔ PHẦN NGHIÊN CỨU VÀ CHUYỂN GIAO CÔNG NGHỆ XỬ LÝ CHẤT THẢI CDG
"HG HOLDINGS.,JSC","HG HOLDINGS.,JSC",CÔNG TY CỔ PHẦN ĐẦU TƯ HG
-1,-1,CÔNG TY TNHH MỘT THÀNH VIÊN YẾN HẢI GIANG
TEKMART,TEKMART,CÔNG TY TNHH TEKMART VIỆT NAM
"Y AN EQUIPMENT MEDICAL TRADE CO., LTD","Y AN EQUIPMENT MEDICAL TRADE CO., LTD",CÔNG TY TNHH THƯƠNG MẠI THIẾT BỊ Y TẾ Y AN
-1,-1,CÔNG TY TNHH TINO MEN
-1,-1,CÔNG TY CỔ PHẦN ĐẦU TƯ PHÁT TRIỂN & HỢP TÁC QUỐC TẾ HÀ GIA
-1,-1,CÔNG TY TNHH THỦY CANH RAU SẠCH VIỆT
-1,-1,CÔNG TY TNHH MỘT THÀNH VIÊN XÂY DỰNG NGỌC Á ĐÔNG
-1,-1,CÔNG TY TNHH THƯƠNG MẠI ĐẦU TƯ XĂNG DẦU BÌNH AN
-1,-1,CÔNG TY TNHH MTV CHUYỂN DỌN PHƯƠNG NAM
-1,-1,CÔNG TY TNHH THƯƠNG MẠI VÀ XUẤT NHẬP KHẨU TUẤN SƠN
"VIET AN INVEST CO., LTD","VIET AN INVEST CO., LTD",CÔNG TY TNHH ĐẦU TƯ QUỐC TẾ VIỆT AN
-1,TIN PHAT SERVICE AGRICULTURE JOINT STOCK COMPANY,CÔNG TY CỔ PHẦN DỊCH VỤ NÔNG NGHIỆP TÍN PHÁT
-1,-1,CÔNG TY CỔ PHẦN THƯƠNG MẠI VÀ DỊCH VỤ HOÀNG MINH CHÂU
-1,-1,CÔNG TY TNHH DỊCH VỤ THƯƠNG MẠI VÀ XÂY DỰNG TÙNG THANH
"TRUONG SON SDV., JSC","TRUONG SON SDV., JSC",CÔNG TY CỔ PHẦN THIẾT BỊ ĐIỆN TRƯỜNG SƠN - SDV
-1,-1,CÔNG TY CỔ PHẦN DẠY NGHỀ ĐƯỜNG THUỶ NỘI ĐỊA
CTY TNHH TM DV CHE RY,Che Ry Trading Services Limited Liability Company,Công Ty TNHH Thương Mại Dịch Vụ Che Ry
LBC-TT,LBC-TT,CÔNG TY TNHH MỘT THÀNH VIÊN LONG BÌNH TRI TÔN
"SPEEDY VIET CO.,LTD","SPEEDY VIET CO.,LTD",CÔNG TY TNHH SPEEDY VIỆT
-1,-1,CÔNG TY CỔ PHẦN SẢN XUẤT THƯƠNG MẠI DỊCH VỤ THB
CÔNG TY TNHH TM HOÀN HÙNG,CÔNG TY TNHH TM HOÀN HÙNG,CÔNG TY TNHH THƯƠNG MẠI HOÀN HÙNG
OLYM MEDIA COMPANY,OLYM MEDIA AND PRODUCTION JOINT STOCK COMPANY,CÔNG TY CỔ PHẦN SẢN XUẤT VÀ TRUYỀN THÔNG OLYM
-1,-1,CÔNG TY TNHH THƯƠNG MẠI VÀ DỊCH VỤ NAM KHÁNH
-1,-1,CÔNG TY TNHH MỘT THÀNH VIÊN NAM Á
HOANG PHAT BUILDING MATERIALS TRADING COMPANY LIMITED,HOANG PHAT BUILDING MATERIALS TRADING COMPANY LIMITED,CÔNG TY TNHH THƯƠNG MẠI VẬT LIỆU XÂY DỰNG HOÀNG PHÁT
-1,A.Z DESIGN INTERIOR &AMP; ARCHITECTURE JOINT STOCK COMPANY,CÔNG TY CỔ PHẦN KIẾN TRÚC & NỘI THẤT A.Z DESIGN
-1,-1,CÔNG TY TNHH NÔNG NGHIỆP XANH BẢO MINH
K.T.V JSC,K.T.V JSC,CÔNG TY CP KHOÁNG SẢN KTV
-1,-1,CÔNG TY CỔ PHẦN XÂY LẮP BÌNH MINH VIỆT
-1,"DAI PHAT LOC IMEX CO., LTD",CÔNG TY TNHH THƯƠNG MẠI VÀ XUẤT NHẬP KHẨU ĐẠI PHÁT LỘC
MINH KHIEM NGHI IMPORT EXPORT COMPANY LIMITED,MINH KHIEM NGHI IMPORT EXPORT COMPANY LIMITED,CÔNG TY TNHH XUẤT NHẬP KHẨU MINH KHIÊM NGHỊ
TM-DV PHUONG ANH COMPANY LIMITED,TM-DV PHUONG ANH COMPANY LIMITED,CÔNG TY TNHH TM-DV PHƯƠNG ANH
"MINH PHU BUSINESS INVESTMENT CO., LTD","MINH PHU BUSINESS INVESTMENT CO., LTD",CÔNG TY TNHH ĐẦU TƯ KINH DOANH MINH PHÚ
-1,ELI CONSULTANT VIETNAM,CÔNG TY CP DỊCH VỤ QUỐC TẾ ELI CONSULTANT VIETNAM
-1,-1,CÔNG TY TNHH CÔNG NGHỆ VÀ DỊCH VỤ MẠNH QUYỀN
-1,-1,CÔNG TY TNHH MINI SCOOTER ĐN
PHUC NGUYEN SERVICE CONSTRUCTION COMPANY LIMITED,PHUC NGUYEN SERVICE CONSTRUCTION COMPANY LIMITED,CÔNG TY TRÁCH NHIỆM HỮU HẠN XÂY DỰNG DỊCH VỤ PHÚC NGUYÊN
-1,-1,CÔNG TY TNHH SẢN XUẤT TINH TIỀU
-1,THAI THINH HOANG CO,CÔNG TY TNHH THÁI THỊNH HOÀNG
-1,-1,CÔNG TY TNHH TRẦN MẠNH TUẤN
"VULCANO CO., LTD","VULCANO CO., LTD",CÔNG TY TNHH VULCANO VIỆT NAM
DONG THANH INVESTMENT CONSULTING CORP,DONG THANH INVESTMENT CONSULTING CORP,CÔNG TY CỔ PHẦN TƯ VẤN ĐẦU TƯ ĐÔNG THÀNH
CÔNG TY TNHH DV XD TV CƯỜNG PHÁT,CÔNG TY TNHH DV XD TV CƯỜNG PHÁT,CÔNG TY TNHH DỊCH VỤ XÂY DỰNG TV CƯỜNG PHÁT
-1,-1,Công Ty Cổ Phần Sản Xuất Nhựa Hyp
JS GLOBAL VINA COMPANY LIMITED,JS GLOBAL VINA COMPANY LIMITED,CÔNG TY TNHH JS GLOBAL VINA
-1,TK CONSTRUCTION INVESTMENT JSC,CÔNG TY CỔ PHẦN ĐẦU TƯ XÂY DỰNG TK
-1,-1,CÔNG TY TNHH HÀ ĐỨC NGÃI
-1,-1,CÔNG TY CỔ PHẦN XÂY DỰNG SỐ 5
-1,-1,CÔNG TY TNHH SẢN XUẤT VÀ THƯƠNG MẠI TÍN PHÚC
HOANG TRONG TRADING SERVICE GARMENT COMPANY LIMITED,HOANG TRONG TRADING SERVICE GARMENT COMPANY LIMITED,CÔNG TY TNHH THƯƠNG MẠI DỊCH VỤ MAY HOÀNG TRỌNG
-1,H.f.t Vietnam Technology Company Limited,Công Ty TNHH Công Nghệ H.f.t Việt Nam
PHƯƠNG THẢO,PHƯƠNG THẢO,CÔNG TY TNHH PHƯƠNG THẢO
TIEN TUAN TRADING JOINT STOCK COMPANY,TIEN TUAN TRADING JOINT STOCK COMPANY,CÔNG TY CỔ PHẦN THƯƠNG MẠI TIẾN TUẤN
-1,-1,CÔNG TY CỔ PHẦN TMDS QUỐC TẾ - VĂN PHÒNG ĐẠI DIỆN TỈNH BẮC GIANG
"TOMEX VIETNAM VIL.,JSC",TOMEX VIETNAM VENTURE INTERNATIONAL JOINT STOCK COMPANY,CÔNG TY CỔ PHẦN LIÊN DOANH QUỐC TẾ TOMEX VIỆT NAM
-1,-1,Công Ty TNHH Thương Mại Dịch Vụ Kỹ Thuật Công Nghệ An Thành Phát
-1,-1,CÔNG TY TNHH MTV TM DV BẢO NGỌC
MOSAIC THANG LONG COMPANY LIMITED,MOSAIC THANG LONG COMPANY LIMITED,CÔNG TY TNHH MOSAIC THĂNG LONG
"SUBBABA., JSC",Subbaba Technology And Investment Joint Stock Company,Công Ty Cổ Phần Công Nghệ Và Đầu Tư Subbaba
HUEVATCO,HUEVATCO,CÔNG TY CỔ PHẦN TƯ VẤN THUẾ HUEVAT
"CHANG & JIN CO.,LTD","CHANG & JIN CO.,LTD",CÔNG TY TNHH CHANG & JIN
"HSC.,JSC",HUNG SON INVESMENT CONSTRUCTION AND COMMERCE JOINT STOCK COMPANY,CÔNG TY CỔ PHẦN ĐẦU TƯ XÂY DỰNG VÀ THƯƠNG MẠI HÙNG SƠN
-1,-1,CÔNG TY TNHH THƯƠNG MẠI DỊCH VỤ XÂY LẮP ĐIỆN QUỐC CƯỜNG
-1,-1,CÔNG TY TNHH NÔNG NGHIỆP DƯỢC LIỆU Y HỌC CỔ TRUYỀN
-1,-1,CÔNG TY TNHH THƯƠNG MẠI XÂY DỰNG PHÚC LONG HƯNG
"MOVIC ARC ., JSC","MOVIC ARC ., JSC",CÔNG TY CỔ PHẦN KIẾN TRÚC MOVIC
-1,-1,CÔNG TY TNHH BIA VÀ NƯỚC GIẢI KHÁT QUỐC TẾ
-1,CÔNG TY HOA TULIP VÀNG,CÔNG TY TNHH THÉP TRÍ DANH
-1,-1,CÔNG TY CỔ PHẦN THIẾT BỊ GIÁO DỤC TRẺ EM C&T
-1,-1,CÔNG TY TNHH MỘT THÀNH VIÊN TM & DV ĐỨC BÌNH
"GIA KHANH CO.,LTD","GIA KHANH CO.,LTD",CÔNG TY TNHH THƯƠNG MẠI DỊCH VỤ GIA KHÁNH
-1,-1,Công Ty TNHH Thương Mại Kỹ Thuật Cơ Khí Tự Do
HA ANH TC ONE MEMBER CPMPANY LIMITED,HA ANH TC ONE MEMBER CPMPANY LIMITED,CÔNG TY TNHH 1 THÀNH VIÊN TC HÀ ANH
-1,"LAM QUOC ANH IME CO., LTD",CÔNG TY TNHH MTV XUẤT NHẬP KHẨU LÂM QUỐC ANH
DAIRY VIETNAM ONE MEMBER COMPANY LIMITED,DAIRY VIETNAM ONE MEMBER COMPANY LIMITED,CÔNG TY TNHH MỘT THÀNH VIÊN NGÀNH SỮA VIỆT NAM
-1,-1,CÔNG TY CỔ PHẦN TƯ VẤN XÂY DỰNG NÔNG CỐNG
"4U INVEST CO.,LTD",4U INVESTMENT COMPANY LIMITED,CÔNG TY TNHH ĐẦU TƯ 4U
-1,-1,CÔNG TY CỔ PHẦN THƯƠNG MẠI VÀ TỔ CHỨC HỘI CHỢ TRIỂN LÃM QUỐC TẾ THÁI BÌNH DƯƠNG
-1,-1,CÔNG TY TNHH MỘT THÀNH VIÊN THƯƠNG MẠI DỊCH VỤ CHẾ BIẾN VĂN THỰC
-1,-1,CÔNG TY TNHH KHANH THỊNH
CÔNG TY TNHH CƯỜNG PHƯƠNG,CÔNG TY TNHH CƯỜNG PHƯƠNG,CÔNG TY TRÁCH NHIỆM HỮU HẠN CƯỜNG PHƯƠNG
"HACIDI., JSC","HACIDI., JSC",CÔNG TY CP TƯ VẤN ĐẦU TƯ XÂY DỰNG VÀ PHÁT TRIỂN HẠ TẦNG ĐÔ THỊ HÀ NỘI
"KORTRADE CO., LTD","KORTRADE CO., LTD",CÔNG TY TNHH THƯƠNG MẠI BĂNG KEO KOREA
"PHAN AN CONSTRUCTION CO.,LTD","PHAN AN CONSTRUCTION CO.,LTD",CÔNG TY TNHH XÂY DỰNG SẢN XUẤT DỊCH VỤ THƯƠNG MẠI PHAN AN
THREE OWLS TRADING CORP,THREE OWLS TRADING CORP,CÔNG TY CỔ PHẦN THƯƠNG MẠI BA CON CÚ
NAM QUOC EQUIPMENT TRADE JSC,NAM QUOC EQUIPMENT TRADE JOINT STOCK COMPANY,CÔNG TY CỔ PHẦN THƯƠNG MẠI THIẾT BỊ NAM QUỐC
-1,-1,CÔNG TY TNHH QUỐC HỌC
"HADICO LAND., JSC","HADICO LAND., JSC",CÔNG TY CỔ PHẦN ĐẦU TƯ VÀ PHÁT TRIỂN ĐỊA ỐC HÀ NỘI
LITTLE STARS EDUCATION DEVELOPMENT CENTER JOINT STOCK COMPAN,Little Stars Education Development Center Joint Stock Company,Công Ty Cổ Phần Trung Tâm Phát Triển Giáo Dục Little Stars
TAM DUC BOILER COMPANY LIMITED,TAM DUC BOILER COMPANY LIMITED,CÔNG TY TNHH MỘT THÀNH VIÊN NỒI HƠI TÂM ĐỨC
DONG TIEN TD TM DV JSC,DONG TIEN TD TM DV JSC,CÔNG TY CỔ PHẦN TM DV TĐ ĐỒNG TIỀN
-1,TADAHOME CONSTRUCTION AND FURNITURE DESIGN COMPANY LIMITED,CÔNG TY TNHH THIẾT KẾ XÂY DỰNG VÀ NỘI THẤT TADAHOME
-1,-1,CÔNG TY TNHH THƯƠNG MẠI TRẦN GIA THỊNH
-1,-1,CÔNG TY TNHH ĐẦU TƯ VÀ THƯƠNG MẠI XÂY DỰNG TRƯỜNG AN
-1,-1,CÔNG TY TNHH THƯƠNG MẠI DỊCH VỤ V.PRO
RUBIE HOTEL,RUBIE HOTEL COMPANY LIMITED,CÔNG TY TNHH RUBIE HOTEL
-1,-1,CÔNG TY CỔ PHẦN BẤT ĐỘNG SẢN CENT GROUP
-1,-1,CÔNG TY TNHH MỘT THÀNH VIÊN QUỐC TẾ VIỆT
-1,-1,CÔNG TY TNHH GIA CÔNG MAY MẶC VIỆT LONG
-1,-1,CÔNG TY TNHH SHAN TUI VIỆT NAM
-1,-1,CÔNG TY TNHH HẢI GIA LAI
-1,-1,CÔNG TY TNHH XÂY DỰNG VÀ THƯƠNG MẠI ĐÔNG Á
-1,Minh Phuc Mechanical Electrical Engineering Joint Stock Company,Công Ty Cổ Phần Kỹ Thuật Cơ Điện Minh Phúc
-1,HONG QUANG CO.LTD,CÔNG TY TNHH HỒNG QUANG
-1,-1,CÔNG TY CỔ PHẦN TỔNG HỢP TUẤN MINH ANH
"THANG LONG DEVELOPMENT AND SECURITY CO.,LTD","THANG LONG DEVELOPMENT AND SECURITY CO.,LTD",CÔNG TY TNHH BẢO VỆ VÀ PHÁT TRIỂN THĂNG LONG
PHUCYEN I P JSCO,PHUC YEN INVESTMENT AND PROPERTY JOINT STOCK COMPANY,CÔNG TY CỔ PHẦN ĐỊA ỐC VÀ ĐẦU TƯ PHÚC YÊN
HAPPY,HAPPY,CÔNG TY CỔ PHẦN THƯƠNG MẠI VÀ DỊCH VỤ HAPPY
-1,-1,CÔNG TY TNHH MỘT THÀNH VIÊN QUẢNG CÁO HẢI ÂU
